No.,Time,Source,Destination,Protocol,Length,Info,Len
1,0.0,172.28.0.20,172.28.0.10,TCP,74,37376  >  5000 [SYN] Seq=0 Win=64240 Len=0 MSS=1460 SACK_PERM TSval=1939742742 TSecr=0 WS=1024,0
2,5.4e-05,172.28.0.10,172.28.0.20,TCP,74,"5000  >  37376 [SYN, ACK] Seq=0 Ack=1 Win=65160 Len=0 MSS=1460 SACK_PERM TSval=3899639529 TSecr=1939742742 WS=1024",0
3,0.100146,172.28.0.20,172.28.0.10,TCP,66,37376  >  5000 [ACK] Seq=1 Ack=1 Win=64512 Len=0 TSval=1939742842 TSecr=3899639529,0
4,0.100227,172.28.0.20,172.28.0.10,TCP,171,"37376  >  5000 [PSH, ACK] Seq=1 Ack=1 Win=64512 Len=105 TSval=1939742842 TSecr=3899639529",105
5,0.100244,172.28.0.10,172.28.0.20,TCP,66,5000  >  37376 [ACK] Seq=1 Ack=106 Win=65536 Len=0 TSval=3899639629 TSecr=1939742842,0
6,0.100338,172.28.0.20,172.28.0.10,RSL,2962,[Malformed Packet],0
7,0.100351,172.28.0.10,172.28.0.20,TCP,66,5000  >  37376 [ACK] Seq=1 Ack=3002 Win=71680 Len=0 TSval=3899639629 TSecr=1939742842,0
8,0.100369,172.28.0.20,172.28.0.10,TCP,2962,"37376  >  5000 [PSH, ACK] Seq=3002 Ack=1 Win=64512 Len=2896 TSval=1939742842 TSecr=3899639529",2896
9,0.100373,172.28.0.10,172.28.0.20,TCP,66,5000  >  37376 [ACK] Seq=1 Ack=5898 Win=77824 Len=0 TSval=3899639629 TSecr=1939742842,0
10,0.100375,172.28.0.20,172.28.0.10,TCP,2962,"37376  >  5000 [PSH, ACK] Seq=5898 Ack=1 Win=64512 Len=2896 TSval=1939742842 TSecr=3899639529",2896
11,0.100379,172.28.0.10,172.28.0.20,TCP,66,5000  >  37376 [ACK] Seq=1 Ack=8794 Win=82944 Len=0 TSval=3899639629 TSecr=1939742842,0
12,0.100499,172.28.0.10,172.28.0.20,TCP,66,"5000  >  55206 [FIN, ACK] Seq=1 Ack=1 Win=96 Len=0 TSval=3899639630 TSecr=1939600920",0
13,0.200313,172.28.0.20,172.28.0.10,TCP,2962,"[TCP Previous segment not captured] 37376  >  5000 [PSH, ACK] Seq=13138 Ack=1 Win=64512 Len=2896 TSval=1939742942 TSecr=3899639629",2896
14,0.200345,172.28.0.10,172.28.0.20,TCP,78,[TCP Window Update] 5000  >  37376 [ACK] Seq=1 Ack=8794 Win=89088 Len=0 TSval=3899639729 TSecr=1939742842 SLE=13138 SRE=16034,0
15,0.200379,172.28.0.20,172.28.0.10,TCP,2962,"37376  >  5000 [PSH, ACK] Seq=16034 Ack=1 Win=64512 Len=2896 TSval=1939742942 TSecr=3899639629",2896
16,0.200383,172.28.0.10,172.28.0.20,TCP,78,[TCP Window Update] 5000  >  37376 [ACK] Seq=1 Ack=8794 Win=93184 Len=0 TSval=3899639729 TSecr=1939742842 SLE=13138 SRE=18930,0
17,0.200404,172.28.0.20,172.28.0.10,TCP,2962,"[TCP Previous segment not captured] 37376  >  5000 [PSH, ACK] Seq=21826 Ack=1 Win=64512 Len=2896 TSval=1939742942 TSecr=3899639629",2896
18,0.200408,172.28.0.10,172.28.0.20,TCP,86,[TCP Dup ACK 11#1] 5000  >  37376 [ACK] Seq=1 Ack=8794 Win=93184 Len=0 TSval=3899639729 TSecr=1939742842 SLE=21826 SRE=24722 SLE=13138 SRE=18930,0
19,0.20041,172.28.0.20,172.28.0.10,TCP,2962,"37376  >  5000 [PSH, ACK] Seq=24722 Ack=1 Win=64512 Len=2896 TSval=1939742942 TSecr=3899639629",2896
20,0.200414,172.28.0.10,172.28.0.20,TCP,86,[TCP Dup ACK 11#2] 5000  >  37376 [ACK] Seq=1 Ack=8794 Win=93184 Len=0 TSval=3899639729 TSecr=1939742842 SLE=21826 SRE=27618 SLE=13138 SRE=18930,0
21,0.20042,172.28.0.20,172.28.0.10,TCP,2962,"[TCP Previous segment not captured] 37376  >  5000 [PSH, ACK] Seq=30514 Ack=1 Win=64512 Len=2896 TSval=1939742942 TSecr=3899639629",2896
22,0.200424,172.28.0.10,172.28.0.20,TCP,94,[TCP Dup ACK 11#3] 5000  >  37376 [ACK] Seq=1 Ack=8794 Win=93184 Len=0 TSval=3899639730 TSecr=1939742842 SLE=30514 SRE=33410 SLE=21826 SRE=27618 SLE=13138 SRE=18930,0
23,0.20053,172.28.0.20,172.28.0.10,TCP,54,55206  >  5000 [RST] Seq=1 Win=0 Len=0,0
24,0.300514,172.28.0.20,172.28.0.10,TCP,2962,"[TCP Out-Of-Order] 37376  >  5000 [PSH, ACK] Seq=8794 Ack=1 Win=64512 Len=2896 TSval=1939743042 TSecr=3899639729",2896
25,0.300556,172.28.0.10,172.28.0.20,TCP,94,5000  >  37376 [ACK] Seq=1 Ack=11690 Win=91136 Len=0 TSval=3899639830 TSecr=1939743042 SLE=30514 SRE=33410 SLE=21826 SRE=27618 SLE=13138 SRE=18930,0
26,0.30056,172.28.0.20,172.28.0.10,TCP,1514,[TCP Out-Of-Order] 37376  >  5000 [ACK] Seq=11690 Ack=1 Win=64512 Len=1448 TSval=1939743042 TSecr=3899639729,1448
27,0.300568,172.28.0.10,172.28.0.20,TCP,86,5000  >  37376 [ACK] Seq=1 Ack=18930 Win=83968 Len=0 TSval=3899639830 TSecr=1939743042 SLE=30514 SRE=33410 SLE=21826 SRE=27618,0
28,0.30057,172.28.0.20,172.28.0.10,TCP,2962,"[TCP Retransmission] 37376  >  5000 [PSH, ACK] Seq=18930 Ack=1 Win=64512 Len=2896 TSval=1939743043 TSecr=3899639729",2896
29,0.300576,172.28.0.10,172.28.0.20,TCP,78,5000  >  37376 [ACK] Seq=1 Ack=27618 Win=79872 Len=0 TSval=3899639830 TSecr=1939743043 SLE=30514 SRE=33410,0
30,0.300578,172.28.0.20,172.28.0.10,RSL,2962,ERROR REPORT ,0
31,0.300583,172.28.0.10,172.28.0.20,TCP,78,[TCP Dup ACK 29#1] 5000  >  37376 [ACK] Seq=1 Ack=27618 Win=79872 Len=0 TSval=3899639830 TSecr=1939743043 SLE=30514 SRE=36306,0
32,0.300585,172.28.0.20,172.28.0.10,TCP,2962,"[TCP Out-Of-Order] 37376  >  5000 [PSH, ACK] Seq=27618 Ack=1 Win=64512 Len=2896 TSval=1939743043 TSecr=3899639730",2896
33,0.30059,172.28.0.10,172.28.0.20,TCP,66,5000  >  37376 [ACK] Seq=1 Ack=36306 Win=75776 Len=0 TSval=3899639830 TSecr=1939743043,0
34,0.300592,172.28.0.20,172.28.0.10,TCP,1514,37376  >  5000 [ACK] Seq=36306 Ack=1 Win=64512 Len=1448 TSval=1939743043 TSecr=3899639730,1448
35,0.300596,172.28.0.10,172.28.0.20,TCP,66,5000  >  37376 [ACK] Seq=1 Ack=37754 Win=74752 Len=0 TSval=3899639830 TSecr=1939743043,0
36,0.400658,172.28.0.20,172.28.0.10,RSL,2962,DELETE INDication (CCCH) (SM) ,0
37,0.400697,172.28.0.10,172.28.0.20,TCP,66,5000  >  37376 [ACK] Seq=1 Ack=40650 Win=96256 Len=0 TSval=3899639930 TSecr=1939743143,0
38,0.400701,172.28.0.20,172.28.0.10,TCP,1514,37376  >  5000 [ACK] Seq=40650 Ack=1 Win=64512 Len=1448 TSval=1939743143 TSecr=3899639830,1448
39,0.400706,172.28.0.10,172.28.0.20,TCP,66,5000  >  37376 [ACK] Seq=1 Ack=42098 Win=95232 Len=0 TSval=3899639930 TSecr=1939743143,0
40,0.400708,172.28.0.20,172.28.0.10,RSL,1514,unknown 12 ,0
41,0.400711,172.28.0.10,172.28.0.20,TCP,66,5000  >  37376 [ACK] Seq=1 Ack=43546 Win=94208 Len=0 TSval=3899639930 TSecr=1939743143,0
42,0.400756,172.28.0.20,172.28.0.10,TCP,2962,"37376  >  5000 [PSH, ACK] Seq=43546 Ack=1 Win=64512 Len=2896 TSval=1939743143 TSecr=3899639830",2896
43,0.400761,172.28.0.10,172.28.0.20,TCP,66,5000  >  37376 [ACK] Seq=1 Ack=46442 Win=92160 Len=0 TSval=3899639930 TSecr=1939743143,0
44,0.400763,172.28.0.20,172.28.0.10,RSL,2962,[Malformed Packet],0
45,0.400767,172.28.0.10,172.28.0.20,TCP,66,5000  >  37376 [ACK] Seq=1 Ack=49338 Win=90112 Len=0 TSval=3899639930 TSecr=1939743143,0
46,0.400769,172.28.0.20,172.28.0.10,TCP,2962,"37376  >  5000 [PSH, ACK] Seq=49338 Ack=1 Win=64512 Len=2896 TSval=1939743143 TSecr=3899639830",2896
47,0.400772,172.28.0.20,172.28.0.10,TCP,1514,37376  >  5000 [ACK] Seq=52234 Ack=1 Win=64512 Len=1448 TSval=1939743143 TSecr=3899639830,1448
48,0.400817,172.28.0.10,172.28.0.20,TCP,66,5000  >  37376 [ACK] Seq=1 Ack=53682 Win=96256 Len=0 TSval=3899639930 TSecr=1939743143,0
49,0.50077,172.28.0.20,172.28.0.10,TCP,2962,"37376  >  5000 [PSH, ACK] Seq=53682 Ack=1 Win=64512 Len=2896 TSval=1939743243 TSecr=3899639930",2896
50,0.500811,172.28.0.10,172.28.0.20,TCP,66,5000  >  37376 [ACK] Seq=1 Ack=56578 Win=96256 Len=0 TSval=3899640030 TSecr=1939743243,0
51,0.500815,172.28.0.20,172.28.0.10,TCP,2962,"37376  >  5000 [PSH, ACK] Seq=56578 Ack=1 Win=64512 Len=2896 TSval=1939743243 TSecr=3899639930",2896
52,0.500853,172.28.0.20,172.28.0.10,TCP,2962,"37376  >  5000 [PSH, ACK] Seq=59474 Ack=1 Win=64512 Len=2896 TSval=1939743243 TSecr=3899639930",2896
53,0.500857,172.28.0.20,172.28.0.10,TCP,2962,"37376  >  5000 [PSH, ACK] Seq=62370 Ack=1 Win=64512 Len=2896 TSval=1939743243 TSecr=3899639930",2896
54,0.50086,172.28.0.20,172.28.0.10,TCP,2962,"37376  >  5000 [PSH, ACK] Seq=65266 Ack=1 Win=64512 Len=2896 TSval=1939743243 TSecr=3899639930",2896
55,0.500867,172.28.0.20,172.28.0.10,TCP,2962,"37376  >  5000 [PSH, ACK] Seq=68162 Ack=1 Win=64512 Len=2896 TSval=1939743243 TSecr=3899639930",2896
56,0.500921,172.28.0.10,172.28.0.20,TCP,66,5000  >  37376 [ACK] Seq=1 Ack=71058 Win=96256 Len=0 TSval=3899640030 TSecr=1939743243,0
57,0.600895,172.28.0.20,172.28.0.10,TCP,2962,"[TCP Previous segment not captured] 37376  >  5000 [PSH, ACK] Seq=72506 Ack=1 Win=64512 Len=2896 TSval=1939743343 TSecr=3899640030",2896
58,0.600935,172.28.0.10,172.28.0.20,TCP,78,[TCP Dup ACK 56#1] 5000  >  37376 [ACK] Seq=1 Ack=71058 Win=96256 Len=0 TSval=3899640130 TSecr=1939743243 SLE=72506 SRE=75402,0
59,0.60098,172.28.0.20,172.28.0.10,TCP,2962,"37376  >  5000 [PSH, ACK] Seq=75402 Ack=1 Win=64512 Len=2896 TSval=1939743343 TSecr=3899640030",2896
60,0.600986,172.28.0.10,172.28.0.20,TCP,78,[TCP Dup ACK 56#2] 5000  >  37376 [ACK] Seq=1 Ack=71058 Win=96256 Len=0 TSval=3899640130 TSecr=1939743243 SLE=72506 SRE=78298,0
61,0.600988,172.28.0.20,172.28.0.10,TCP,2962,"37376  >  5000 [PSH, ACK] Seq=78298 Ack=1 Win=64512 Len=2896 TSval=1939743343 TSecr=3899640030",2896
62,0.600992,172.28.0.10,172.28.0.20,TCP,78,[TCP Dup ACK 56#3] 5000  >  37376 [ACK] Seq=1 Ack=71058 Win=96256 Len=0 TSval=3899640130 TSecr=1939743243 SLE=72506 SRE=81194,0
63,0.600994,172.28.0.20,172.28.0.10,TCP,2962,"37376  >  5000 [PSH, ACK] Seq=81194 Ack=1 Win=64512 Len=2896 TSval=1939743343 TSecr=3899640030",2896
64,0.600998,172.28.0.10,172.28.0.20,TCP,78,[TCP Dup ACK 56#4] 5000  >  37376 [ACK] Seq=1 Ack=71058 Win=96256 Len=0 TSval=3899640130 TSecr=1939743243 SLE=72506 SRE=84090,0
65,0.600999,172.28.0.20,172.28.0.10,RSL,2962,DELETE INDication (CCCH) (SM) ,0
66,0.601002,172.28.0.20,172.28.0.10,TCP,2962,"37376  >  5000 [PSH, ACK] Seq=86986 Ack=1 Win=64512 Len=2896 TSval=1939743343 TSecr=3899640030",2896
67,0.60212,172.28.0.10,172.28.0.20,TCP,78,[TCP Dup ACK 56#5] 5000  >  37376 [ACK] Seq=1 Ack=71058 Win=96256 Len=0 TSval=3899640131 TSecr=1939743243 SLE=72506 SRE=89882,0
68,0.701007,172.28.0.20,172.28.0.10,TCP,1514,[TCP Out-Of-Order] 37376  >  5000 [ACK] Seq=71058 Ack=1 Win=64512 Len=1448 TSval=1939743443 TSecr=3899640130,1448
69,0.701066,172.28.0.10,172.28.0.20,TCP,66,5000  >  37376 [ACK] Seq=1 Ack=89882 Win=82944 Len=0 TSval=3899640230 TSecr=1939743443,0
70,0.701117,172.28.0.20,172.28.0.10,TCP,1514,[TCP Previous segment not captured] 37376  >  5000 [ACK] Seq=91330 Ack=1 Win=64512 Len=1448 TSval=1939743443 TSecr=3899640130,1448
71,0.701126,172.28.0.10,172.28.0.20,TCP,78,[TCP Dup ACK 69#1] 5000  >  37376 [ACK] Seq=1 Ack=89882 Win=82944 Len=0 TSval=3899640230 TSecr=1939743443 SLE=91330 SRE=92778,0
72,0.701128,172.28.0.20,172.28.0.10,RSL,2962,[Malformed Packet],0
73,0.701134,172.28.0.10,172.28.0.20,TCP,78,[TCP Dup ACK 69#2] 5000  >  37376 [ACK] Seq=1 Ack=89882 Win=82944 Len=0 TSval=3899640230 TSecr=1939743443 SLE=91330 SRE=95674,0
74,0.702161,172.28.0.20,172.28.0.10,TCP,2962,"37376  >  5000 [PSH, ACK] Seq=95674 Ack=1 Win=64512 Len=2896 TSval=1939743444 TSecr=3899640131",2896
75,0.702186,172.28.0.10,172.28.0.20,TCP,78,[TCP Window Update] 5000  >  37376 [ACK] Seq=1 Ack=89882 Win=92160 Len=0 TSval=3899640231 TSecr=1939743443 SLE=91330 SRE=98570,0
76,0.702189,172.28.0.20,172.28.0.10,TCP,2962,"37376  >  5000 [PSH, ACK] Seq=98570 Ack=1 Win=64512 Len=2896 TSval=1939743444 TSecr=3899640131",2896
77,0.703304,172.28.0.10,172.28.0.20,TCP,78,[TCP Dup ACK 69#3] 5000  >  37376 [ACK] Seq=1 Ack=89882 Win=92160 Len=0 TSval=3899640232 TSecr=1939743443 SLE=91330 SRE=101466,0
78,0.801215,172.28.0.20,172.28.0.10,TCP,1514,37376  >  5000 [ACK] Seq=101466 Ack=1 Win=64512 Len=1448 TSval=1939743543 TSecr=3899640230,1448
79,0.801237,172.28.0.20,172.28.0.10,TCP,1514,[TCP Out-Of-Order] 37376  >  5000 [ACK] Seq=89882 Ack=1 Win=64512 Len=1448 TSval=1939743543 TSecr=3899640230,1448
80,0.801257,172.28.0.10,172.28.0.20,TCP,66,5000  >  37376 [ACK] Seq=1 Ack=102914 Win=88064 Len=0 TSval=3899640330 TSecr=1939743543,0
81,0.80225,172.28.0.20,172.28.0.10,TCP,2962,"37376  >  5000 [PSH, ACK] Seq=102914 Ack=1 Win=64512 Len=2896 TSval=1939743544 TSecr=3899640231",2896
82,0.802271,172.28.0.10,172.28.0.20,TCP,66,5000  >  37376 [ACK] Seq=1 Ack=105810 Win=96256 Len=0 TSval=3899640331 TSecr=1939743544,0
83,0.803349,172.28.0.20,172.28.0.10,TCP,2962,"37376  >  5000 [PSH, ACK] Seq=105810 Ack=1 Win=64512 Len=2896 TSval=1939743545 TSecr=3899640232",2896
84,0.803362,172.28.0.10,172.28.0.20,TCP,66,5000  >  37376 [ACK] Seq=1 Ack=108706 Win=96256 Len=0 TSval=3899640332 TSecr=1939743545,0
85,0.901328,172.28.0.20,172.28.0.10,TCP,2962,"37376  >  5000 [PSH, ACK] Seq=108706 Ack=1 Win=64512 Len=2896 TSval=1939743643 TSecr=3899640330",2896
86,0.901365,172.28.0.10,172.28.0.20,TCP,66,5000  >  37376 [ACK] Seq=1 Ack=111602 Win=96256 Len=0 TSval=3899640430 TSecr=1939743643,0
87,0.902296,172.28.0.20,172.28.0.10,TCP,2962,"37376  >  5000 [PSH, ACK] Seq=111602 Ack=1 Win=64512 Len=2896 TSval=1939743644 TSecr=3899640331",2896
88,0.902308,172.28.0.10,172.28.0.20,TCP,66,5000  >  37376 [ACK] Seq=1 Ack=114498 Win=96256 Len=0 TSval=3899640431 TSecr=1939743644,0
89,0.903394,172.28.0.20,172.28.0.10,TCP,2962,"37376  >  5000 [PSH, ACK] Seq=114498 Ack=1 Win=64512 Len=2896 TSval=1939743645 TSecr=3899640332",2896
90,0.903401,172.28.0.10,172.28.0.20,TCP,66,5000  >  37376 [ACK] Seq=1 Ack=117394 Win=96256 Len=0 TSval=3899640432 TSecr=1939743645,0
91,0.903403,172.28.0.20,172.28.0.10,TCP,1514,37376  >  5000 [ACK] Seq=117394 Ack=1 Win=64512 Len=1448 TSval=1939743645 TSecr=3899640332,1448
92,0.943444,172.28.0.10,172.28.0.20,TCP,66,5000  >  37376 [ACK] Seq=1 Ack=118842 Win=98304 Len=0 TSval=3899640473 TSecr=1939743645,0
93,1.002463,172.28.0.20,172.28.0.10,TCP,2962,"[TCP Previous segment not captured] 37376  >  5000 [PSH, ACK] Seq=121738 Ack=1 Win=64512 Len=2896 TSval=1939743744 TSecr=3899640431",2896
94,1.002498,172.28.0.10,172.28.0.20,TCP,78,[TCP Dup ACK 92#1] 5000  >  37376 [ACK] Seq=1 Ack=118842 Win=98304 Len=0 TSval=3899640532 TSecr=1939743645 SLE=121738 SRE=124634,0
95,1.003519,172.28.0.20,172.28.0.10,TCP,2962,"37376  >  5000 [PSH, ACK] Seq=124634 Ack=1 Win=64512 Len=2896 TSval=1939743745 TSecr=3899640432",2896
96,1.003554,172.28.0.10,172.28.0.20,TCP,78,[TCP Dup ACK 92#2] 5000  >  37376 [ACK] Seq=1 Ack=118842 Win=98304 Len=0 TSval=3899640533 TSecr=1939743645 SLE=121738 SRE=127530,0
97,1.043511,172.28.0.20,172.28.0.10,TCP,1514,37376  >  5000 [ACK] Seq=127530 Ack=1 Win=64512 Len=1448 TSval=1939743786 TSecr=3899640473,1448
98,1.043546,172.28.0.10,172.28.0.20,TCP,78,[TCP Dup ACK 92#3] 5000  >  37376 [ACK] Seq=1 Ack=118842 Win=98304 Len=0 TSval=3899640573 TSecr=1939743645 SLE=121738 SRE=128978,0
99,1.102672,172.28.0.20,172.28.0.10,TCP,2962,"37376  >  5000 [PSH, ACK] Seq=128978 Ack=1 Win=64512 Len=2896 TSval=1939743845 TSecr=3899640532",2896
100,1.103697,172.28.0.20,172.28.0.10,TCP,1514,[TCP Out-Of-Order] 37376  >  5000 [ACK] Seq=118842 Ack=1 Win=64512 Len=1448 TSval=1939743846 TSecr=3899640533,1448
101,1.103734,172.28.0.10,172.28.0.20,TCP,78,5000  >  37376 [ACK] Seq=1 Ack=120290 Win=97280 Len=0 TSval=3899640633 TSecr=1939743846 SLE=121738 SRE=131874,0
102,1.143729,172.28.0.20,172.28.0.10,TCP,1514,[TCP Out-Of-Order] 37376  >  5000 [ACK] Seq=120290 Ack=1 Win=64512 Len=1448 TSval=1939743886 TSecr=3899640573,1448
103,1.14377,172.28.0.10,172.28.0.20,TCP,66,5000  >  37376 [ACK] Seq=1 Ack=131874 Win=89088 Len=0 TSval=3899640673 TSecr=1939743886,0
104,1.203913,172.28.0.20,172.28.0.10,TCP,2962,"37376  >  5000 [PSH, ACK] Seq=131874 Ack=1 Win=64512 Len=2896 TSval=1939743946 TSecr=3899640633",2896
105,1.203953,172.28.0.10,172.28.0.20,TCP,66,5000  >  37376 [ACK] Seq=1 Ack=134770 Win=96256 Len=0 TSval=3899640733 TSecr=1939743946,0
106,1.203957,172.28.0.20,172.28.0.10,RSL,1514,unknown 12 ,0
107,1.24391,172.28.0.20,172.28.0.10,TCP,1514,37376  >  5000 [ACK] Seq=136218 Ack=1 Win=64512 Len=1448 TSval=1939743986 TSecr=3899640673,1448
108,1.243948,172.28.0.10,172.28.0.20,TCP,66,5000  >  37376 [ACK] Seq=1 Ack=137666 Win=97280 Len=0 TSval=3899640773 TSecr=1939743946,0
109,1.304107,172.28.0.20,172.28.0.10,TCP,2962,"37376  >  5000 [PSH, ACK] Seq=137666 Ack=1 Win=64512 Len=2896 TSval=1939744046 TSecr=3899640733",2896
110,1.304258,172.28.0.10,172.28.0.20,TCP,66,5000  >  37376 [ACK] Seq=1 Ack=140562 Win=98304 Len=0 TSval=3899640833 TSecr=1939744046,0
111,1.344008,172.28.0.20,172.28.0.10,TCP,2962,"37376  >  5000 [PSH, ACK] Seq=140562 Ack=1 Win=64512 Len=2896 TSval=1939744086 TSecr=3899640773",2896
112,1.344035,172.28.0.20,172.28.0.10,TCP,1514,37376  >  5000 [ACK] Seq=143458 Ack=1 Win=64512 Len=1448 TSval=1939744086 TSecr=3899640773,1448
113,1.344116,172.28.0.10,172.28.0.20,TCP,66,5000  >  37376 [ACK] Seq=1 Ack=144906 Win=98304 Len=0 TSval=3899640873 TSecr=1939744086,0
114,1.444202,172.28.0.20,172.28.0.10,TCP,2962,"[TCP Previous segment not captured] 37376  >  5000 [PSH, ACK] Seq=150698 Ack=1 Win=64512 Len=2896 TSval=1939744186 TSecr=3899640873",2896
115,1.444236,172.28.0.10,172.28.0.20,TCP,78,[TCP Dup ACK 113#1] 5000  >  37376 [ACK] Seq=1 Ack=144906 Win=98304 Len=0 TSval=3899640973 TSecr=1939744086 SLE=150698 SRE=153594,0
116,1.544409,172.28.0.20,172.28.0.10,TCP,2962,"[TCP Retransmission] 37376  >  5000 [PSH, ACK] Seq=144906 Ack=1 Win=64512 Len=2896 TSval=1939744286 TSecr=3899640973",2896
117,1.544452,172.28.0.10,172.28.0.20,TCP,78,5000  >  37376 [ACK] Seq=1 Ack=147802 Win=96256 Len=0 TSval=3899641074 TSecr=1939744286 SLE=150698 SRE=153594,0
118,1.572577,172.28.0.20,172.28.0.10,TCP,2962,"[TCP Retransmission] 37376  >  5000 [PSH, ACK] Seq=147802 Ack=1 Win=64512 Len=2896 TSval=1939744315 TSecr=3899640973",2896
119,1.57263,172.28.0.10,172.28.0.20,TCP,66,5000  >  37376 [ACK] Seq=1 Ack=153594 Win=93184 Len=0 TSval=3899641102 TSecr=1939744315,0
120,1.644513,172.28.0.20,172.28.0.10,TCP,2962,"37376  >  5000 [PSH, ACK] Seq=153594 Ack=1 Win=64512 Len=2896 TSval=1939744387 TSecr=3899641074",2896
121,1.644562,172.28.0.10,172.28.0.20,TCP,66,5000  >  37376 [ACK] Seq=1 Ack=156490 Win=96256 Len=0 TSval=3899641174 TSecr=1939744387,0
122,1.672688,172.28.0.20,172.28.0.10,TCP,2962,"37376  >  5000 [PSH, ACK] Seq=156490 Ack=1 Win=64512 Len=2896 TSval=1939744415 TSecr=3899641102",2896
123,1.672735,172.28.0.10,172.28.0.20,TCP,66,5000  >  37376 [ACK] Seq=1 Ack=159386 Win=96256 Len=0 TSval=3899641202 TSecr=1939744415,0
124,1.744736,172.28.0.20,172.28.0.10,TCP,2962,"37376  >  5000 [PSH, ACK] Seq=159386 Ack=1 Win=64512 Len=2896 TSval=1939744487 TSecr=3899641174",2896
125,1.744784,172.28.0.10,172.28.0.20,TCP,66,5000  >  37376 [ACK] Seq=1 Ack=162282 Win=96256 Len=0 TSval=3899641274 TSecr=1939744487,0
126,1.744787,172.28.0.20,172.28.0.10,TCP,1514,37376  >  5000 [ACK] Seq=162282 Ack=1 Win=64512 Len=1448 TSval=1939744487 TSecr=3899641174,1448
127,1.772906,172.28.0.20,172.28.0.10,TCP,2962,"37376  >  5000 [PSH, ACK] Seq=163730 Ack=1 Win=64512 Len=2896 TSval=1939744515 TSecr=3899641202",2896
128,1.772952,172.28.0.10,172.28.0.20,TCP,66,5000  >  37376 [ACK] Seq=1 Ack=166626 Win=96256 Len=0 TSval=3899641302 TSecr=1939744487,0
129,1.844838,172.28.0.20,172.28.0.10,TCP,2962,"37376  >  5000 [PSH, ACK] Seq=166626 Ack=1 Win=64512 Len=2896 TSval=1939744587 TSecr=3899641274",2896
130,1.844883,172.28.0.10,172.28.0.20,TCP,66,5000  >  37376 [ACK] Seq=1 Ack=169522 Win=96256 Len=0 TSval=3899641374 TSecr=1939744587,0
131,1.873025,172.28.0.20,172.28.0.10,TCP,2962,"37376  >  5000 [PSH, ACK] Seq=169522 Ack=1 Win=64512 Len=2896 TSval=1939744615 TSecr=3899641302",2896
132,1.873061,172.28.0.10,172.28.0.20,TCP,66,5000  >  37376 [ACK] Seq=1 Ack=172418 Win=96256 Len=0 TSval=3899641402 TSecr=1939744615,0
133,1.873065,172.28.0.20,172.28.0.10,RSL,1514,ERROR REPORT ,0
134,1.920538,172.28.0.10,172.28.0.20,TCP,66,5000  >  37376 [ACK] Seq=1 Ack=173866 Win=98304 Len=0 TSval=3899641450 TSecr=1939744615,0
135,1.944955,172.28.0.20,172.28.0.10,TCP,2962,"37376  >  5000 [PSH, ACK] Seq=173866 Ack=1 Win=64512 Len=2896 TSval=1939744687 TSecr=3899641374",2896
136,1.945006,172.28.0.10,172.28.0.20,TCP,66,5000  >  37376 [ACK] Seq=1 Ack=176762 Win=98304 Len=0 TSval=3899641474 TSecr=1939744687,0
137,1.97328,172.28.0.20,172.28.0.10,RSL,2962,DELETE INDication (CCCH) (SM) ,0
138,1.973355,172.28.0.10,172.28.0.20,TCP,66,5000  >  37376 [ACK] Seq=1 Ack=179658 Win=98304 Len=0 TSval=3899641502 TSecr=1939744715,0
139,2.020603,172.28.0.20,172.28.0.10,TCP,1514,37376  >  5000 [ACK] Seq=179658 Ack=1 Win=64512 Len=1448 TSval=1939744763 TSecr=3899641450,1448
140,2.045062,172.28.0.20,172.28.0.10,RSL,2962,PAGING Huawei extension ,0
141,2.045124,172.28.0.10,172.28.0.20,TCP,66,5000  >  37376 [ACK] Seq=1 Ack=184002 Win=98304 Len=0 TSval=3899641574 TSecr=1939744763,0
142,2.1452,172.28.0.20,172.28.0.10,TCP,1514,[TCP Previous segment not captured] 37376  >  5000 [ACK] Seq=191242 Ack=1 Win=64512 Len=1448 TSval=1939744887 TSecr=3899641574,1448
143,2.145232,172.28.0.10,172.28.0.20,TCP,78,[TCP Dup ACK 141#1] 5000  >  37376 [ACK] Seq=1 Ack=184002 Win=98304 Len=0 TSval=3899641674 TSecr=1939744763 SLE=191242 SRE=192690,0
144,2.245292,172.28.0.20,172.28.0.10,TCP,1514,[TCP Out-Of-Order] 37376  >  5000 [ACK] Seq=184002 Ack=1 Win=64512 Len=1448 TSval=1939744987 TSecr=3899641674,1448
145,2.245328,172.28.0.10,172.28.0.20,TCP,78,5000  >  37376 [ACK] Seq=1 Ack=185450 Win=97280 Len=0 TSval=3899641774 TSecr=1939744987 SLE=191242 SRE=192690,0
146,2.272579,172.28.0.20,172.28.0.10,TCP,1514,[TCP Retransmission] 37376  >  5000 [ACK] Seq=186898 Ack=1 Win=64512 Len=1448 TSval=1939745015 TSecr=3899641674,1448
147,2.272613,172.28.0.10,172.28.0.20,TCP,86,[TCP Dup ACK 145#1] 5000  >  37376 [ACK] Seq=1 Ack=185450 Win=97280 Len=0 TSval=3899641802 TSecr=1939744987 SLE=186898 SRE=188346 SLE=191242 SRE=192690,0
148,2.345495,172.28.0.20,172.28.0.10,TCP,2962,"[TCP Retransmission] 37376  >  5000 [PSH, ACK] Seq=188346 Ack=1 Win=64512 Len=2896 TSval=1939745087 TSecr=3899641774",2896
149,2.345532,172.28.0.10,172.28.0.20,TCP,78,[TCP Dup ACK 145#2] 5000  >  37376 [ACK] Seq=1 Ack=185450 Win=97280 Len=0 TSval=3899641875 TSecr=1939744987 SLE=186898 SRE=192690,0
150,2.37266,172.28.0.20,172.28.0.10,TCP,1514,[TCP Retransmission] 37376  >  5000 [ACK] Seq=185450 Ack=1 Win=64512 Len=1448 TSval=1939745115 TSecr=3899641802,1448
151,2.372697,172.28.0.10,172.28.0.20,TCP,66,5000  >  37376 [ACK] Seq=1 Ack=192690 Win=92160 Len=0 TSval=3899641902 TSecr=1939745115,0
152,2.44571,172.28.0.20,172.28.0.10,TCP,1514,37376  >  5000 [ACK] Seq=192690 Ack=1 Win=64512 Len=1448 TSval=1939745188 TSecr=3899641875,1448
153,2.472755,172.28.0.20,172.28.0.10,TCP,2962,"[TCP Previous segment not captured] 37376  >  5000 [PSH, ACK] Seq=195586 Ack=1 Win=64512 Len=2896 TSval=1939745215 TSecr=3899641902",2896
154,2.47279,172.28.0.10,172.28.0.20,TCP,78,5000  >  37376 [ACK] Seq=1 Ack=194138 Win=96256 Len=0 TSval=3899642002 TSecr=1939745188 SLE=195586 SRE=198482,0
155,2.572946,172.28.0.20,172.28.0.10,TCP,2962,"37376  >  5000 [PSH, ACK] Seq=198482 Ack=1 Win=64512 Len=2896 TSval=1939745315 TSecr=3899642002",2896
156,2.57298,172.28.0.10,172.28.0.20,TCP,78,[TCP Dup ACK 154#1] 5000  >  37376 [ACK] Seq=1 Ack=194138 Win=96256 Len=0 TSval=3899642102 TSecr=1939745188 SLE=195586 SRE=201378,0
157,2.572985,172.28.0.20,172.28.0.10,TCP,2962,"37376  >  5000 [PSH, ACK] Seq=201378 Ack=1 Win=64512 Len=2896 TSval=1939745315 TSecr=3899642002",2896
158,2.572989,172.28.0.10,172.28.0.20,TCP,78,[TCP Dup ACK 154#2] 5000  >  37376 [ACK] Seq=1 Ack=194138 Win=96256 Len=0 TSval=3899642102 TSecr=1939745188 SLE=195586 SRE=204274,0
159,2.600592,172.28.0.20,172.28.0.10,TCP,1514,[TCP Out-Of-Order] 37376  >  5000 [ACK] Seq=194138 Ack=1 Win=64512 Len=1448 TSval=1939745343 TSecr=3899642002,1448
160,2.600635,172.28.0.10,172.28.0.20,TCP,66,5000  >  37376 [ACK] Seq=1 Ack=204274 Win=90112 Len=0 TSval=3899642130 TSecr=1939745343,0
161,2.67317,172.28.0.20,172.28.0.10,TCP,1514,37376  >  5000 [ACK] Seq=204274 Ack=1 Win=64512 Len=1448 TSval=1939745415 TSecr=3899642102,1448
162,2.6732,172.28.0.20,172.28.0.10,TCP,1514,37376  >  5000 [ACK] Seq=205722 Ack=1 Win=64512 Len=1448 TSval=1939745415 TSecr=3899642102,1448
163,2.673214,172.28.0.10,172.28.0.20,TCP,66,5000  >  37376 [ACK] Seq=1 Ack=207170 Win=95232 Len=0 TSval=3899642202 TSecr=1939745415,0
164,2.773271,172.28.0.20,172.28.0.10,TCP,2962,"[TCP Previous segment not captured] 37376  >  5000 [PSH, ACK] Seq=208618 Ack=1 Win=64512 Len=2896 TSval=1939745515 TSecr=3899642202",2896
165,2.773311,172.28.0.10,172.28.0.20,TCP,78,[TCP Window Update] 5000  >  37376 [ACK] Seq=1 Ack=207170 Win=96256 Len=0 TSval=3899642302 TSecr=1939745415 SLE=208618 SRE=211514,0
166,2.773315,172.28.0.20,172.28.0.10,TCP,1514,37376  >  5000 [ACK] Seq=211514 Ack=1 Win=64512 Len=1448 TSval=1939745515 TSecr=3899642202,1448
167,2.77332,172.28.0.10,172.28.0.20,TCP,78,[TCP Dup ACK 163#1] 5000  >  37376 [ACK] Seq=1 Ack=207170 Win=96256 Len=0 TSval=3899642302 TSecr=1939745415 SLE=208618 SRE=212962,0
168,2.873452,172.28.0.20,172.28.0.10,TCP,1514,[TCP Out-Of-Order] 37376  >  5000 [ACK] Seq=207170 Ack=1 Win=64512 Len=1448 TSval=1939745615 TSecr=3899642302,1448
169,2.873479,172.28.0.10,172.28.0.20,TCP,66,5000  >  37376 [ACK] Seq=1 Ack=212962 Win=93184 Len=0 TSval=3899642403 TSecr=1939745615,0
170,2.873481,172.28.0.20,172.28.0.10,TCP,1514,37376  >  5000 [ACK] Seq=212962 Ack=1 Win=64512 Len=1448 TSval=1939745615 TSecr=3899642302,1448
171,2.921448,172.28.0.10,172.28.0.20,TCP,66,5000  >  37376 [ACK] Seq=1 Ack=214410 Win=98304 Len=0 TSval=3899642451 TSecr=1939745615,0
172,3.021526,172.28.0.20,172.28.0.10,TCP,1514,"[TCP Previous segment not captured] 37376  >  5000 [PSH, ACK] Seq=215858 Ack=1 Win=64512 Len=1448 TSval=1939745764 TSecr=3899642451",1448
173,3.021559,172.28.0.10,172.28.0.20,TCP,78,[TCP Dup ACK 171#1] 5000  >  37376 [ACK] Seq=1 Ack=214410 Win=98304 Len=0 TSval=3899642551 TSecr=1939745615 SLE=215858 SRE=217306,0
174,3.021562,172.28.0.20,172.28.0.10,TCP,1514,37376  >  5000 [ACK] Seq=217306 Ack=1 Win=64512 Len=1448 TSval=1939745764 TSecr=3899642451,1448
175,3.021567,172.28.0.10,172.28.0.20,TCP,78,[TCP Dup ACK 171#2] 5000  >  37376 [ACK] Seq=1 Ack=214410 Win=98304 Len=0 TSval=3899642551 TSecr=1939745615 SLE=215858 SRE=218754,0
176,3.121757,172.28.0.20,172.28.0.10,TCP,1514,[TCP Retransmission] 37376  >  5000 [ACK] Seq=214410 Ack=1 Win=64512 Len=1448 TSval=1939745864 TSecr=3899642551,1448
177,3.121797,172.28.0.10,172.28.0.20,TCP,66,5000  >  37376 [ACK] Seq=1 Ack=218754 Win=94208 Len=0 TSval=3899642651 TSecr=1939745864,0
178,3.121801,172.28.0.20,172.28.0.10,RSL,1514,ERROR REPORT ,0
179,3.191465,172.28.0.10,172.28.0.20,TCP,66,5000  >  37376 [ACK] Seq=1 Ack=220202 Win=98304 Len=0 TSval=3899642721 TSecr=1939745864,0
180,3.221875,172.28.0.20,172.28.0.10,TCP,1514,37376  >  5000 [ACK] Seq=220202 Ack=1 Win=64512 Len=1448 TSval=1939745964 TSecr=3899642651,1448
181,3.327585,172.28.0.10,172.28.0.20,TCP,66,5000  >  37376 [ACK] Seq=1 Ack=221650 Win=98304 Len=0 TSval=3899642857 TSecr=1939745964,0
182,3.427794,172.28.0.20,172.28.0.10,RSL,1514,[TCP Previous segment not captured] DELETE INDication (CCCH) (SM) ,0
183,3.427828,172.28.0.10,172.28.0.20,TCP,78,[TCP Dup ACK 181#1] 5000  >  37376 [ACK] Seq=1 Ack=221650 Win=98304 Len=0 TSval=3899642957 TSecr=1939745964 SLE=223098 SRE=224546,0
184,3.527891,172.28.0.20,172.28.0.10,TCP,1514,[TCP Out-Of-Order] 37376  >  5000 [ACK] Seq=221650 Ack=1 Win=64512 Len=1448 TSval=1939746270 TSecr=3899642957,1448
185,3.527938,172.28.0.10,172.28.0.20,TCP,66,5000  >  37376 [ACK] Seq=1 Ack=224546 Win=96256 Len=0 TSval=3899643057 TSecr=1939746270,0
186,3.627999,172.28.0.20,172.28.0.10,TCP,1514,37376  >  5000 [ACK] Seq=224546 Ack=1 Win=64512 Len=1448 TSval=1939746370 TSecr=3899643057,1448
187,3.62803,172.28.0.10,172.28.0.20,TCP,66,5000  >  37376 [ACK] Seq=1 Ack=225994 Win=97280 Len=0 TSval=3899643157 TSecr=1939746370,0
188,3.628033,172.28.0.20,172.28.0.10,TCP,1514,37376  >  5000 [ACK] Seq=225994 Ack=1 Win=64512 Len=1448 TSval=1939746370 TSecr=3899643057,1448
189,3.628038,172.28.0.10,172.28.0.20,TCP,66,5000  >  37376 [ACK] Seq=1 Ack=227442 Win=96256 Len=0 TSval=3899643157 TSecr=1939746370,0
190,3.728106,172.28.0.20,172.28.0.10,RSL,1514,unknown 12 ,0
191,3.728147,172.28.0.10,172.28.0.20,TCP,66,5000  >  37376 [ACK] Seq=1 Ack=228890 Win=97280 Len=0 TSval=3899643257 TSecr=1939746470,0
192,3.728152,172.28.0.20,172.28.0.10,TCP,1514,37376  >  5000 [ACK] Seq=228890 Ack=1 Win=64512 Len=1448 TSval=1939746470 TSecr=3899643157,1448
193,3.728157,172.28.0.10,172.28.0.20,TCP,66,5000  >  37376 [ACK] Seq=1 Ack=230338 Win=96256 Len=0 TSval=3899643257 TSecr=1939746470,0
194,3.828204,172.28.0.20,172.28.0.10,TCP,1514,37376  >  5000 [ACK] Seq=230338 Ack=1 Win=64512 Len=1448 TSval=1939746570 TSecr=3899643257,1448
195,3.82823,172.28.0.10,172.28.0.20,TCP,66,5000  >  37376 [ACK] Seq=1 Ack=231786 Win=97280 Len=0 TSval=3899643357 TSecr=1939746570,0
196,3.828232,172.28.0.20,172.28.0.10,RSL,1514,[Malformed Packet],0
197,3.828245,172.28.0.10,172.28.0.20,TCP,66,5000  >  37376 [ACK] Seq=1 Ack=233234 Win=97280 Len=0 TSval=3899643357 TSecr=1939746570,0
198,3.828256,172.28.0.20,172.28.0.10,TCP,2962,"37376  >  5000 [PSH, ACK] Seq=233234 Ack=1 Win=64512 Len=2896 TSval=1939746570 TSecr=3899643257",2896
199,3.828266,172.28.0.10,172.28.0.20,TCP,66,5000  >  37376 [ACK] Seq=1 Ack=236130 Win=96256 Len=0 TSval=3899643357 TSecr=1939746570,0
200,3.928273,172.28.0.20,172.28.0.10,TCP,1514,37376  >  5000 [ACK] Seq=236130 Ack=1 Win=64512 Len=1448 TSval=1939746670 TSecr=3899643357,1448
201,3.9283,172.28.0.10,172.28.0.20,TCP,66,5000  >  37376 [ACK] Seq=1 Ack=237578 Win=97280 Len=0 TSval=3899643457 TSecr=1939746670,0
202,3.92832,172.28.0.20,172.28.0.10,TCP,1514,37376  >  5000 [ACK] Seq=237578 Ack=1 Win=64512 Len=1448 TSval=1939746670 TSecr=3899643357,1448
203,3.928323,172.28.0.10,172.28.0.20,TCP,66,5000  >  37376 [ACK] Seq=1 Ack=239026 Win=96256 Len=0 TSval=3899643457 TSecr=1939746670,0
204,3.928324,172.28.0.20,172.28.0.10,TCP,2962,"37376  >  5000 [PSH, ACK] Seq=239026 Ack=1 Win=64512 Len=2896 TSval=1939746670 TSecr=3899643357",2896
205,3.928326,172.28.0.10,172.28.0.20,TCP,66,5000  >  37376 [ACK] Seq=1 Ack=241922 Win=94208 Len=0 TSval=3899643457 TSecr=1939746670,0
206,4.028345,172.28.0.20,172.28.0.10,TCP,1514,37376  >  5000 [ACK] Seq=241922 Ack=1 Win=64512 Len=1448 TSval=1939746770 TSecr=3899643457,1448
207,4.028382,172.28.0.10,172.28.0.20,TCP,66,5000  >  37376 [ACK] Seq=1 Ack=243370 Win=97280 Len=0 TSval=3899643557 TSecr=1939746770,0
208,4.028414,172.28.0.20,172.28.0.10,TCP,1514,37376  >  5000 [ACK] Seq=243370 Ack=1 Win=64512 Len=1448 TSval=1939746770 TSecr=3899643457,1448
209,4.028427,172.28.0.10,172.28.0.20,TCP,66,5000  >  37376 [ACK] Seq=1 Ack=244818 Win=97280 Len=0 TSval=3899643558 TSecr=1939746770,0
210,4.028429,172.28.0.20,172.28.0.10,TCP,2962,"37376  >  5000 [PSH, ACK] Seq=244818 Ack=1 Win=64512 Len=2896 TSval=1939746770 TSecr=3899643457",2896
211,4.028433,172.28.0.10,172.28.0.20,TCP,66,5000  >  37376 [ACK] Seq=1 Ack=247714 Win=95232 Len=0 TSval=3899643558 TSecr=1939746770,0
212,4.128459,172.28.0.20,172.28.0.10,TCP,1514,37376  >  5000 [ACK] Seq=247714 Ack=1 Win=64512 Len=1448 TSval=1939746870 TSecr=3899643557,1448
213,4.128496,172.28.0.10,172.28.0.20,TCP,66,5000  >  37376 [ACK] Seq=1 Ack=249162 Win=97280 Len=0 TSval=3899643658 TSecr=1939746870,0
214,4.128529,172.28.0.20,172.28.0.10,TCP,1514,37376  >  5000 [ACK] Seq=249162 Ack=1 Win=64512 Len=1448 TSval=1939746871 TSecr=3899643558,1448
215,4.128535,172.28.0.10,172.28.0.20,TCP,66,5000  >  37376 [ACK] Seq=1 Ack=250610 Win=96256 Len=0 TSval=3899643658 TSecr=1939746871,0
216,4.128537,172.28.0.20,172.28.0.10,TCP,2962,"37376  >  5000 [PSH, ACK] Seq=250610 Ack=1 Win=64512 Len=2896 TSval=1939746871 TSecr=3899643558",2896
217,4.128605,172.28.0.10,172.28.0.20,TCP,66,5000  >  37376 [ACK] Seq=1 Ack=253506 Win=98304 Len=0 TSval=3899643658 TSecr=1939746871,0
218,4.228543,172.28.0.20,172.28.0.10,TCP,2962,"37376  >  5000 [PSH, ACK] Seq=253506 Ack=1 Win=64512 Len=2896 TSval=1939746971 TSecr=3899643658",2896
219,4.228571,172.28.0.20,172.28.0.10,TCP,1514,37376  >  5000 [ACK] Seq=256402 Ack=1 Win=64512 Len=1448 TSval=1939746971 TSecr=3899643658,1448
220,4.228639,172.28.0.20,172.28.0.10,TCP,2962,"37376  >  5000 [PSH, ACK] Seq=257850 Ack=1 Win=64512 Len=2896 TSval=1939746971 TSecr=3899643658",2896
221,4.228644,172.28.0.20,172.28.0.10,TCP,1514,37376  >  5000 [ACK] Seq=260746 Ack=1 Win=64512 Len=1448 TSval=1939746971 TSecr=3899643658,1448
222,4.228677,172.28.0.10,172.28.0.20,TCP,66,5000  >  37376 [ACK] Seq=1 Ack=262194 Win=98304 Len=0 TSval=3899643758 TSecr=1939746971,0
223,4.328845,172.28.0.20,172.28.0.10,TCP,2962,"37376  >  5000 [PSH, ACK] Seq=262194 Ack=1 Win=64512 Len=2896 TSval=1939747071 TSecr=3899643758",2896
224,4.328885,172.28.0.20,172.28.0.10,RSL,2962,ERROR REPORT ,0
225,4.328927,172.28.0.10,172.28.0.20,TCP,66,5000  >  37376 [ACK] Seq=1 Ack=267986 Win=98304 Len=0 TSval=3899643858 TSecr=1939747071,0
226,4.429093,172.28.0.20,172.28.0.10,TCP,2962,"[TCP Previous segment not captured] 37376  >  5000 [PSH, ACK] Seq=270882 Ack=1 Win=64512 Len=2896 TSval=1939747171 TSecr=3899643858",2896
227,4.429129,172.28.0.10,172.28.0.20,TCP,78,[TCP Dup ACK 225#1] 5000  >  37376 [ACK] Seq=1 Ack=267986 Win=98304 Len=0 TSval=3899643958 TSecr=1939747071 SLE=270882 SRE=273778,0
228,4.429134,172.28.0.20,172.28.0.10,RSL,2962,PAGING Huawei extension ,0
229,4.429139,172.28.0.10,172.28.0.20,TCP,78,[TCP Dup ACK 225#2] 5000  >  37376 [ACK] Seq=1 Ack=267986 Win=98304 Len=0 TSval=3899643958 TSecr=1939747071 SLE=270882 SRE=276674,0
230,4.529322,172.28.0.20,172.28.0.10,TCP,2962,"37376  >  5000 [PSH, ACK] Seq=276674 Ack=1 Win=64512 Len=2896 TSval=1939747271 TSecr=3899643958",2896
231,4.529359,172.28.0.10,172.28.0.20,TCP,78,[TCP Dup ACK 225#3] 5000  >  37376 [ACK] Seq=1 Ack=267986 Win=98304 Len=0 TSval=3899644058 TSecr=1939747071 SLE=270882 SRE=279570,0
232,4.629495,172.28.0.20,172.28.0.10,TCP,2962,"[TCP Retransmission] 37376  >  5000 [PSH, ACK] Seq=267986 Ack=1 Win=64512 Len=2896 TSval=1939747371 TSecr=3899644058",2896
233,4.629546,172.28.0.10,172.28.0.20,TCP,66,5000  >  37376 [ACK] Seq=1 Ack=279570 Win=89088 Len=0 TSval=3899644159 TSecr=1939747371,0
234,4.729713,172.28.0.20,172.28.0.10,TCP,2962,"37376  >  5000 [PSH, ACK] Seq=279570 Ack=1 Win=64512 Len=2896 TSval=1939747472 TSecr=3899644159",2896
235,4.729761,172.28.0.10,172.28.0.20,TCP,66,5000  >  37376 [ACK] Seq=1 Ack=282466 Win=96256 Len=0 TSval=3899644259 TSecr=1939747472,0
236,4.729766,172.28.0.20,172.28.0.10,TCP,2962,"37376  >  5000 [PSH, ACK] Seq=282466 Ack=1 Win=64512 Len=2896 TSval=1939747472 TSecr=3899644159",2896
237,4.729825,172.28.0.10,172.28.0.20,TCP,66,5000  >  37376 [ACK] Seq=1 Ack=285362 Win=98304 Len=0 TSval=3899644259 TSecr=1939747472,0
238,4.829848,172.28.0.20,172.28.0.10,TCP,2962,"37376  >  5000 [PSH, ACK] Seq=285362 Ack=1 Win=64512 Len=2896 TSval=1939747572 TSecr=3899644259",2896
239,4.829888,172.28.0.20,172.28.0.10,TCP,2962,"37376  >  5000 [PSH, ACK] Seq=288258 Ack=1 Win=64512 Len=2896 TSval=1939747572 TSecr=3899644259",2896
240,4.829892,172.28.0.20,172.28.0.10,TCP,1514,37376  >  5000 [ACK] Seq=291154 Ack=1 Win=64512 Len=1448 TSval=1939747572 TSecr=3899644259,1448
241,4.829917,172.28.0.10,172.28.0.20,TCP,66,5000  >  37376 [ACK] Seq=1 Ack=292602 Win=98304 Len=0 TSval=3899644359 TSecr=1939747572,0
242,4.929987,172.28.0.20,172.28.0.10,TCP,2962,"37376  >  5000 [PSH, ACK] Seq=292602 Ack=1 Win=64512 Len=2896 TSval=1939747672 TSecr=3899644359",2896
243,4.930024,172.28.0.20,172.28.0.10,TCP,2962,"37376  >  5000 [PSH, ACK] Seq=295498 Ack=1 Win=64512 Len=2896 TSval=1939747672 TSecr=3899644359",2896
244,4.930027,172.28.0.20,172.28.0.10,TCP,1514,37376  >  5000 [ACK] Seq=298394 Ack=1 Win=64512 Len=1448 TSval=1939747672 TSecr=3899644359,1448
245,4.930061,172.28.0.10,172.28.0.20,TCP,66,5000  >  37376 [ACK] Seq=1 Ack=299842 Win=98304 Len=0 TSval=3899644459 TSecr=1939747672,0
246,5.030134,172.28.0.20,172.28.0.10,TCP,2962,"37376  >  5000 [PSH, ACK] Seq=299842 Ack=1 Win=64512 Len=2896 TSval=1939747772 TSecr=3899644459",2896
247,5.030167,172.28.0.20,172.28.0.10,TCP,2962,"37376  >  5000 [PSH, ACK] Seq=302738 Ack=1 Win=64512 Len=2896 TSval=1939747772 TSecr=3899644459",2896
248,5.030171,172.28.0.20,172.28.0.10,TCP,1514,37376  >  5000 [ACK] Seq=305634 Ack=1 Win=64512 Len=1448 TSval=1939747772 TSecr=3899644459,1448
249,5.030201,172.28.0.10,172.28.0.20,TCP,66,5000  >  37376 [ACK] Seq=1 Ack=307082 Win=98304 Len=0 TSval=3899644559 TSecr=1939747772,0
250,5.130276,172.28.0.20,172.28.0.10,TCP,2962,"37376  >  5000 [PSH, ACK] Seq=307082 Ack=1 Win=64512 Len=2896 TSval=1939747872 TSecr=3899644559",2896
251,5.130313,172.28.0.20,172.28.0.10,TCP,2962,"37376  >  5000 [PSH, ACK] Seq=309978 Ack=1 Win=64512 Len=2896 TSval=1939747872 TSecr=3899644559",2896
252,5.130318,172.28.0.20,172.28.0.10,TCP,2962,"37376  >  5000 [PSH, ACK] Seq=312874 Ack=1 Win=64512 Len=2896 TSval=1939747872 TSecr=3899644559",2896
253,5.130353,172.28.0.10,172.28.0.20,TCP,66,5000  >  37376 [ACK] Seq=1 Ack=315770 Win=98304 Len=0 TSval=3899644659 TSecr=1939747872,0
254,5.230409,172.28.0.20,172.28.0.10,TCP,2962,"[TCP Previous segment not captured] 37376  >  5000 [PSH, ACK] Seq=317218 Ack=1 Win=64512 Len=2896 TSval=1939747972 TSecr=3899644659",2896
255,5.230458,172.28.0.10,172.28.0.20,TCP,78,[TCP Dup ACK 253#1] 5000  >  37376 [ACK] Seq=1 Ack=315770 Win=98304 Len=0 TSval=3899644760 TSecr=1939747872 SLE=317218 SRE=320114,0
256,5.230462,172.28.0.20,172.28.0.10,RSL,2962,PAGING Huawei extension ,0
257,5.230468,172.28.0.10,172.28.0.20,TCP,78,[TCP Dup ACK 253#2] 5000  >  37376 [ACK] Seq=1 Ack=315770 Win=98304 Len=0 TSval=3899644760 TSecr=1939747872 SLE=317218 SRE=323010,0
258,5.230469,172.28.0.20,172.28.0.10,TCP,2962,"37376  >  5000 [PSH, ACK] Seq=323010 Ack=1 Win=64512 Len=2896 TSval=1939747972 TSecr=3899644659",2896
259,5.230474,172.28.0.10,172.28.0.20,TCP,78,[TCP Dup ACK 253#3] 5000  >  37376 [ACK] Seq=1 Ack=315770 Win=98304 Len=0 TSval=3899644760 TSecr=1939747872 SLE=317218 SRE=325906,0
260,5.330524,172.28.0.20,172.28.0.10,TCP,1514,[TCP Out-Of-Order] 37376  >  5000 [ACK] Seq=315770 Ack=1 Win=64512 Len=1448 TSval=1939748073 TSecr=3899644760,1448
261,5.330576,172.28.0.10,172.28.0.20,TCP,66,5000  >  37376 [ACK] Seq=1 Ack=325906 Win=90112 Len=0 TSval=3899644860 TSecr=1939748073,0
262,5.330612,172.28.0.20,172.28.0.10,TCP,1514,37376  >  5000 [ACK] Seq=325906 Ack=1 Win=64512 Len=1448 TSval=1939748073 TSecr=3899644760,1448
263,5.330618,172.28.0.20,172.28.0.10,TCP,2962,"37376  >  5000 [PSH, ACK] Seq=327354 Ack=1 Win=64512 Len=2896 TSval=1939748073 TSecr=3899644760",2896
264,5.330655,172.28.0.10,172.28.0.20,TCP,66,5000  >  37376 [ACK] Seq=1 Ack=330250 Win=98304 Len=0 TSval=3899644860 TSecr=1939748073,0
265,5.430743,172.28.0.20,172.28.0.10,TCP,1514,37376  >  5000 [ACK] Seq=330250 Ack=1 Win=64512 Len=1448 TSval=1939748173 TSecr=3899644860,1448
266,5.430783,172.28.0.20,172.28.0.10,TCP,2962,"37376  >  5000 [PSH, ACK] Seq=331698 Ack=1 Win=64512 Len=2896 TSval=1939748173 TSecr=3899644860",2896
267,5.430788,172.28.0.20,172.28.0.10,TCP,2962,"37376  >  5000 [PSH, ACK] Seq=334594 Ack=1 Win=64512 Len=2896 TSval=1939748173 TSecr=3899644860",2896
268,5.430829,172.28.0.10,172.28.0.20,TCP,66,5000  >  37376 [ACK] Seq=1 Ack=337490 Win=98304 Len=0 TSval=3899644960 TSecr=1939748173,0
269,5.531003,172.28.0.20,172.28.0.10,TCP,2962,"37376  >  5000 [PSH, ACK] Seq=337490 Ack=1 Win=64512 Len=2896 TSval=1939748273 TSecr=3899644960",2896
270,5.531042,172.28.0.20,172.28.0.10,TCP,1514,[TCP Previous segment not captured] 37376  >  5000 [ACK] Seq=343282 Ack=1 Win=64512 Len=1448 TSval=1939748273 TSecr=3899644960,1448
271,5.531058,172.28.0.10,172.28.0.20,TCP,78,5000  >  37376 [ACK] Seq=1 Ack=340386 Win=96256 Len=0 TSval=3899645060 TSecr=1939748273 SLE=343282 SRE=344730,0
272,5.631229,172.28.0.20,172.28.0.10,TCP,2962,"37376  >  5000 [PSH, ACK] Seq=344730 Ack=1 Win=64512 Len=2896 TSval=1939748373 TSecr=3899645060",2896
273,5.631265,172.28.0.10,172.28.0.20,TCP,78,[TCP Dup ACK 271#1] 5000  >  37376 [ACK] Seq=1 Ack=340386 Win=96256 Len=0 TSval=3899645160 TSecr=1939748273 SLE=343282 SRE=347626,0
274,5.731338,172.28.0.20,172.28.0.10,TCP,1514,[TCP Out-Of-Order] 37376  >  5000 [ACK] Seq=341834 Ack=1 Win=64512 Len=1448 TSval=1939748473 TSecr=3899645160,1448
275,5.731357,172.28.0.10,172.28.0.20,TCP,78,[TCP Dup ACK 271#2] 5000  >  37376 [ACK] Seq=1 Ack=340386 Win=96256 Len=0 TSval=3899645260 TSecr=1939748273 SLE=341834 SRE=347626,0
276,5.731358,172.28.0.20,172.28.0.10,TCP,1514,37376  >  5000 [ACK] Seq=347626 Ack=1 Win=64512 Len=1448 TSval=1939748473 TSecr=3899645160,1448
277,5.73249,172.28.0.10,172.28.0.20,TCP,78,[TCP Dup ACK 271#3] 5000  >  37376 [ACK] Seq=1 Ack=340386 Win=96256 Len=0 TSval=3899645262 TSecr=1939748273 SLE=341834 SRE=349074,0
278,5.831407,172.28.0.20,172.28.0.10,TCP,1514,[TCP Out-Of-Order] 37376  >  5000 [ACK] Seq=340386 Ack=1 Win=64512 Len=1448 TSval=1939748573 TSecr=3899645260,1448
279,5.831451,172.28.0.10,172.28.0.20,TCP,66,5000  >  37376 [ACK] Seq=1 Ack=349074 Win=90112 Len=0 TSval=3899645361 TSecr=1939748573,0
280,5.832505,172.28.0.20,172.28.0.10,TCP,1514,37376  >  5000 [ACK] Seq=349074 Ack=1 Win=64512 Len=1448 TSval=1939748575 TSecr=3899645262,1448
281,5.874446,172.28.0.10,172.28.0.20,TCP,66,5000  >  37376 [ACK] Seq=1 Ack=350522 Win=98304 Len=0 TSval=3899645404 TSecr=1939748575,0
282,5.931504,172.28.0.20,172.28.0.10,TCP,1514,37376  >  5000 [ACK] Seq=350522 Ack=1 Win=64512 Len=1448 TSval=1939748674 TSecr=3899645361,1448
283,5.931534,172.28.0.20,172.28.0.10,TCP,1514,37376  >  5000 [ACK] Seq=351970 Ack=1 Win=64512 Len=1448 TSval=1939748674 TSecr=3899645361,1448
284,5.931562,172.28.0.10,172.28.0.20,TCP,66,5000  >  37376 [ACK] Seq=1 Ack=353418 Win=98304 Len=0 TSval=3899645461 TSecr=1939748674,0
285,5.97452,172.28.0.20,172.28.0.10,TCP,1514,37376  >  5000 [ACK] Seq=353418 Ack=1 Win=64512 Len=1448 TSval=1939748717 TSecr=3899645404,1448
286,6.031612,172.28.0.20,172.28.0.10,TCP,2962,"37376  >  5000 [PSH, ACK] Seq=354866 Ack=1 Win=64512 Len=2896 TSval=1939748774 TSecr=3899645461",2896
287,6.031654,172.28.0.10,172.28.0.20,TCP,66,5000  >  37376 [ACK] Seq=1 Ack=357762 Win=96256 Len=0 TSval=3899645561 TSecr=1939748717,0
288,6.031658,172.28.0.20,172.28.0.10,RSL,1514,ERROR REPORT ,0
289,6.103463,172.28.0.10,172.28.0.20,TCP,66,5000  >  37376 [ACK] Seq=1 Ack=359210 Win=98304 Len=0 TSval=3899645633 TSecr=1939748774,0
290,6.131708,172.28.0.20,172.28.0.10,TCP,2962,"37376  >  5000 [PSH, ACK] Seq=359210 Ack=1 Win=64512 Len=2896 TSval=1939748874 TSecr=3899645561",2896
291,6.131779,172.28.0.10,172.28.0.20,TCP,66,5000  >  37376 [ACK] Seq=1 Ack=362106 Win=98304 Len=0 TSval=3899645661 TSecr=1939748874,0
292,6.231908,172.28.0.20,172.28.0.10,TCP,2962,"[TCP Previous segment not captured] 37376  >  5000 [PSH, ACK] Seq=365002 Ack=1 Win=64512 Len=2896 TSval=1939748974 TSecr=3899645661",2896
293,6.23195,172.28.0.10,172.28.0.20,TCP,78,[TCP Dup ACK 291#1] 5000  >  37376 [ACK] Seq=1 Ack=362106 Win=98304 Len=0 TSval=3899645761 TSecr=1939748874 SLE=365002 SRE=367898,0
294,6.332138,172.28.0.20,172.28.0.10,TCP,1514,[TCP Retransmission] 37376  >  5000 [ACK] Seq=363554 Ack=1 Win=64512 Len=1448 TSval=1939749074 TSecr=3899645761,1448
295,6.332173,172.28.0.10,172.28.0.20,TCP,78,[TCP Dup ACK 291#2] 5000  >  37376 [ACK] Seq=1 Ack=362106 Win=98304 Len=0 TSval=3899645861 TSecr=1939748874 SLE=363554 SRE=367898,0
296,6.432327,172.28.0.20,172.28.0.10,TCP,1514,[TCP Retransmission] 37376  >  5000 [ACK] Seq=362106 Ack=1 Win=64512 Len=1448 TSval=1939749174 TSecr=3899645861,1448
297,6.432376,172.28.0.10,172.28.0.20,TCP,66,5000  >  37376 [ACK] Seq=1 Ack=367898 Win=93184 Len=0 TSval=3899645961 TSecr=1939749174,0
298,6.532546,172.28.0.20,172.28.0.10,TCP,1514,37376  >  5000 [ACK] Seq=367898 Ack=1 Win=64512 Len=1448 TSval=1939749274 TSecr=3899645961,1448
299,6.532586,172.28.0.20,172.28.0.10,TCP,1514,37376  >  5000 [ACK] Seq=369346 Ack=1 Win=64512 Len=1448 TSval=1939749274 TSecr=3899645961,1448
300,6.532601,172.28.0.10,172.28.0.20,TCP,66,5000  >  37376 [ACK] Seq=1 Ack=370794 Win=95232 Len=0 TSval=3899646062 TSecr=1939749274,0
301,6.632655,172.28.0.20,172.28.0.10,TCP,1514,[TCP Previous segment not captured] 37376  >  5000 [ACK] Seq=372242 Ack=1 Win=64512 Len=1448 TSval=1939749375 TSecr=3899646062,1448
302,6.632688,172.28.0.10,172.28.0.20,TCP,78,[TCP Window Update] 5000  >  37376 [ACK] Seq=1 Ack=370794 Win=97280 Len=0 TSval=3899646162 TSecr=1939749274 SLE=372242 SRE=373690,0
303,6.632691,172.28.0.20,172.28.0.10,TCP,1514,37376  >  5000 [ACK] Seq=373690 Ack=1 Win=64512 Len=1448 TSval=1939749375 TSecr=3899646062,1448
304,6.632697,172.28.0.10,172.28.0.20,TCP,78,[TCP Dup ACK 300#1] 5000  >  37376 [ACK] Seq=1 Ack=370794 Win=97280 Len=0 TSval=3899646162 TSecr=1939749274 SLE=372242 SRE=375138,0
305,6.732865,172.28.0.20,172.28.0.10,TCP,1514,37376  >  5000 [ACK] Seq=375138 Ack=1 Win=64512 Len=1448 TSval=1939749475 TSecr=3899646162,1448
306,6.732899,172.28.0.10,172.28.0.20,TCP,78,[TCP Dup ACK 300#2] 5000  >  37376 [ACK] Seq=1 Ack=370794 Win=97280 Len=0 TSval=3899646262 TSecr=1939749274 SLE=372242 SRE=376586,0
307,6.732902,172.28.0.20,172.28.0.10,TCP,1514,37376  >  5000 [ACK] Seq=376586 Ack=1 Win=64512 Len=1448 TSval=1939749475 TSecr=3899646162,1448
308,6.734131,172.28.0.10,172.28.0.20,TCP,78,[TCP Dup ACK 300#3] 5000  >  37376 [ACK] Seq=1 Ack=370794 Win=97280 Len=0 TSval=3899646263 TSecr=1939749274 SLE=372242 SRE=378034,0
309,6.760552,172.28.0.20,172.28.0.10,TCP,1514,[TCP Out-Of-Order] 37376  >  5000 [ACK] Seq=370794 Ack=1 Win=64512 Len=1448 TSval=1939749503 TSecr=3899646162,1448
310,6.760596,172.28.0.10,172.28.0.20,TCP,66,5000  >  37376 [ACK] Seq=1 Ack=378034 Win=92160 Len=0 TSval=3899646290 TSecr=1939749503,0
311,6.834203,172.28.0.20,172.28.0.10,TCP,1514,37376  >  5000 [ACK] Seq=378034 Ack=1 Win=64512 Len=1448 TSval=1939749576 TSecr=3899646263,1448
312,6.86077,172.28.0.20,172.28.0.10,TCP,1514,37376  >  5000 [ACK] Seq=379482 Ack=1 Win=64512 Len=1448 TSval=1939749603 TSecr=3899646290,1448
313,6.860817,172.28.0.10,172.28.0.20,TCP,66,5000  >  37376 [ACK] Seq=1 Ack=380930 Win=97280 Len=0 TSval=3899646390 TSecr=1939749576,0
314,6.960984,172.28.0.20,172.28.0.10,TCP,1514,37376  >  5000 [ACK] Seq=380930 Ack=1 Win=64512 Len=1448 TSval=1939749703 TSecr=3899646390,1448
315,6.961023,172.28.0.20,172.28.0.10,TCP,1514,37376  >  5000 [ACK] Seq=382378 Ack=1 Win=64512 Len=1448 TSval=1939749703 TSecr=3899646390,1448
316,6.961064,172.28.0.10,172.28.0.20,TCP,66,5000  >  37376 [ACK] Seq=1 Ack=383826 Win=98304 Len=0 TSval=3899646490 TSecr=1939749703,0
317,7.061136,172.28.0.20,172.28.0.10,TCP,2962,"37376  >  5000 [PSH, ACK] Seq=383826 Ack=1 Win=64512 Len=2896 TSval=1939749803 TSecr=3899646490",2896
318,7.061175,172.28.0.20,172.28.0.10,TCP,2962,"37376  >  5000 [PSH, ACK] Seq=386722 Ack=1 Win=64512 Len=2896 TSval=1939749803 TSecr=3899646490",2896
319,7.061211,172.28.0.10,172.28.0.20,TCP,66,5000  >  37376 [ACK] Seq=1 Ack=389618 Win=98304 Len=0 TSval=3899646590 TSecr=1939749803,0
320,7.161275,172.28.0.20,172.28.0.10,TCP,2962,"37376  >  5000 [PSH, ACK] Seq=389618 Ack=1 Win=64512 Len=2896 TSval=1939749903 TSecr=3899646590",2896
321,7.161317,172.28.0.20,172.28.0.10,TCP,2962,"37376  >  5000 [PSH, ACK] Seq=392514 Ack=1 Win=64512 Len=2896 TSval=1939749903 TSecr=3899646590",2896
322,7.161362,172.28.0.10,172.28.0.20,TCP,66,5000  >  37376 [ACK] Seq=1 Ack=395410 Win=98304 Len=0 TSval=3899646690 TSecr=1939749903,0
323,7.261533,172.28.0.20,172.28.0.10,TCP,2962,"37376  >  5000 [PSH, ACK] Seq=395410 Ack=1 Win=64512 Len=2896 TSval=1939750003 TSecr=3899646690",2896
324,7.261573,172.28.0.20,172.28.0.10,TCP,2962,"37376  >  5000 [PSH, ACK] Seq=398306 Ack=1 Win=64512 Len=2896 TSval=1939750003 TSecr=3899646690",2896
325,7.261614,172.28.0.10,172.28.0.20,TCP,66,5000  >  37376 [ACK] Seq=1 Ack=401202 Win=98304 Len=0 TSval=3899646791 TSecr=1939750003,0
326,7.361675,172.28.0.20,172.28.0.10,TCP,2962,"37376  >  5000 [PSH, ACK] Seq=401202 Ack=1 Win=64512 Len=2896 TSval=1939750104 TSecr=3899646791",2896
327,7.361718,172.28.0.20,172.28.0.10,RSL,2962,ERROR REPORT ,0
328,7.361759,172.28.0.10,172.28.0.20,TCP,66,5000  >  37376 [ACK] Seq=1 Ack=406994 Win=98304 Len=0 TSval=3899646891 TSecr=1939750104,0
329,7.461932,172.28.0.20,172.28.0.10,TCP,2962,"37376  >  5000 [PSH, ACK] Seq=406994 Ack=1 Win=64512 Len=2896 TSval=1939750204 TSecr=3899646891",2896
330,7.461972,172.28.0.20,172.28.0.10,TCP,2962,"37376  >  5000 [PSH, ACK] Seq=409890 Ack=1 Win=64512 Len=2896 TSval=1939750204 TSecr=3899646891",2896
331,7.461976,172.28.0.20,172.28.0.10,RSL,2962,PAGING Huawei extension ,0
332,7.462017,172.28.0.10,172.28.0.20,TCP,66,5000  >  37376 [ACK] Seq=1 Ack=415682 Win=98304 Len=0 TSval=3899646991 TSecr=1939750204,0
333,7.562085,172.28.0.20,172.28.0.10,TCP,2962,"37376  >  5000 [PSH, ACK] Seq=415682 Ack=1 Win=64512 Len=2896 TSval=1939750304 TSecr=3899646991",2896
334,7.562125,172.28.0.20,172.28.0.10,TCP,2962,"[TCP Previous segment not captured] 37376  >  5000 [PSH, ACK] Seq=421474 Ack=1 Win=64512 Len=2896 TSval=1939750304 TSecr=3899646991",2896
335,7.562143,172.28.0.10,172.28.0.20,TCP,78,5000  >  37376 [ACK] Seq=1 Ack=418578 Win=96256 Len=0 TSval=3899647091 TSecr=1939750304 SLE=421474 SRE=424370,0
336,7.662342,172.28.0.20,172.28.0.10,TCP,2962,"37376  >  5000 [PSH, ACK] Seq=424370 Ack=1 Win=64512 Len=2896 TSval=1939750404 TSecr=3899647091",2896
337,7.662377,172.28.0.10,172.28.0.20,TCP,78,[TCP Dup ACK 335#1] 5000  >  37376 [ACK] Seq=1 Ack=418578 Win=96256 Len=0 TSval=3899647191 TSecr=1939750304 SLE=421474 SRE=427266,0
338,7.662382,172.28.0.20,172.28.0.10,TCP,2962,"37376  >  5000 [PSH, ACK] Seq=427266 Ack=1 Win=64512 Len=2896 TSval=1939750404 TSecr=3899647091",2896
339,7.662387,172.28.0.10,172.28.0.20,TCP,78,[TCP Dup ACK 335#2] 5000  >  37376 [ACK] Seq=1 Ack=418578 Win=96256 Len=0 TSval=3899647191 TSecr=1939750304 SLE=421474 SRE=430162,0
340,7.689597,172.28.0.20,172.28.0.10,TCP,1514,[TCP Out-Of-Order] 37376  >  5000 [ACK] Seq=418578 Ack=1 Win=64512 Len=1448 TSval=1939750432 TSecr=3899647091,1448
341,7.689642,172.28.0.10,172.28.0.20,TCP,78,5000  >  37376 [ACK] Seq=1 Ack=420026 Win=95232 Len=0 TSval=3899647219 TSecr=1939750432 SLE=421474 SRE=430162,0
342,7.762567,172.28.0.20,172.28.0.10,TCP,1514,[TCP Retransmission] 37376  >  5000 [ACK] Seq=420026 Ack=1 Win=64512 Len=1448 TSval=1939750504 TSecr=3899647191,1448
343,7.762621,172.28.0.10,172.28.0.20,TCP,66,5000  >  37376 [ACK] Seq=1 Ack=430162 Win=90112 Len=0 TSval=3899647292 TSecr=1939750504,0
344,7.762625,172.28.0.20,172.28.0.10,TCP,2962,"37376  >  5000 [PSH, ACK] Seq=430162 Ack=1 Win=64512 Len=2896 TSval=1939750505 TSecr=3899647191",2896
345,7.762687,172.28.0.10,172.28.0.20,TCP,66,5000  >  37376 [ACK] Seq=1 Ack=433058 Win=98304 Len=0 TSval=3899647292 TSecr=1939750505,0
346,7.789803,172.28.0.20,172.28.0.10,TCP,1514,37376  >  5000 [ACK] Seq=433058 Ack=1 Win=64512 Len=1448 TSval=1939750532 TSecr=3899647219,1448
347,7.83845,172.28.0.10,172.28.0.20,TCP,66,5000  >  37376 [ACK] Seq=1 Ack=434506 Win=98304 Len=0 TSval=3899647368 TSecr=1939750532,0
348,7.862681,172.28.0.20,172.28.0.10,TCP,1514,37376  >  5000 [ACK] Seq=434506 Ack=1 Win=64512 Len=1448 TSval=1939750605 TSecr=3899647292,1448
349,7.862739,172.28.0.20,172.28.0.10,TCP,2962,"37376  >  5000 [PSH, ACK] Seq=435954 Ack=1 Win=64512 Len=2896 TSval=1939750605 TSecr=3899647292",2896
350,7.862773,172.28.0.10,172.28.0.20,TCP,66,5000  >  37376 [ACK] Seq=1 Ack=438850 Win=98304 Len=0 TSval=3899647392 TSecr=1939750605,0
351,7.938569,172.28.0.20,172.28.0.10,TCP,2962,"37376  >  5000 [PSH, ACK] Seq=438850 Ack=1 Win=64512 Len=2896 TSval=1939750681 TSecr=3899647368",2896
352,7.93864,172.28.0.10,172.28.0.20,TCP,66,5000  >  37376 [ACK] Seq=1 Ack=441746 Win=98304 Len=0 TSval=3899647468 TSecr=1939750681,0
353,7.962839,172.28.0.20,172.28.0.10,TCP,2962,"37376  >  5000 [PSH, ACK] Seq=441746 Ack=1 Win=64512 Len=2896 TSval=1939750705 TSecr=3899647392",2896
354,7.962885,172.28.0.20,172.28.0.10,TCP,1514,37376  >  5000 [ACK] Seq=444642 Ack=1 Win=64512 Len=1448 TSval=1939750705 TSecr=3899647392,1448
355,7.962929,172.28.0.10,172.28.0.20,TCP,66,5000  >  37376 [ACK] Seq=1 Ack=446090 Win=98304 Len=0 TSval=3899647492 TSecr=1939750705,0
356,8.03873,172.28.0.20,172.28.0.10,TCP,2962,"37376  >  5000 [PSH, ACK] Seq=446090 Ack=1 Win=64512 Len=2896 TSval=1939750781 TSecr=3899647468",2896
357,8.038792,172.28.0.10,172.28.0.20,TCP,66,5000  >  37376 [ACK] Seq=1 Ack=448986 Win=98304 Len=0 TSval=3899647568 TSecr=1939750781,0
358,8.062985,172.28.0.20,172.28.0.10,TCP,2962,"37376  >  5000 [PSH, ACK] Seq=448986 Ack=1 Win=64512 Len=2896 TSval=1939750805 TSecr=3899647492",2896
359,8.063006,172.28.0.20,172.28.0.10,TCP,1514,37376  >  5000 [ACK] Seq=451882 Ack=1 Win=64512 Len=1448 TSval=1939750805 TSecr=3899647492,1448
360,8.063023,172.28.0.10,172.28.0.20,TCP,66,5000  >  37376 [ACK] Seq=1 Ack=453330 Win=98304 Len=0 TSval=3899647592 TSecr=1939750805,0
361,8.138952,172.28.0.20,172.28.0.10,TCP,2962,"37376  >  5000 [PSH, ACK] Seq=453330 Ack=1 Win=64512 Len=2896 TSval=1939750881 TSecr=3899647568",2896
362,8.138991,172.28.0.20,172.28.0.10,TCP,1514,37376  >  5000 [ACK] Seq=456226 Ack=1 Win=64512 Len=1448 TSval=1939750881 TSecr=3899647568,1448
363,8.13903,172.28.0.10,172.28.0.20,TCP,66,5000  >  37376 [ACK] Seq=1 Ack=457674 Win=98304 Len=0 TSval=3899647668 TSecr=1939750881,0
364,8.163225,172.28.0.20,172.28.0.10,TCP,2962,"37376  >  5000 [PSH, ACK] Seq=457674 Ack=1 Win=64512 Len=2896 TSval=1939750905 TSecr=3899647592",2896
365,8.163264,172.28.0.20,172.28.0.10,TCP,1514,37376  >  5000 [ACK] Seq=460570 Ack=1 Win=64512 Len=1448 TSval=1939750905 TSecr=3899647592,1448
366,8.163304,172.28.0.10,172.28.0.20,TCP,66,5000  >  37376 [ACK] Seq=1 Ack=462018 Win=98304 Len=0 TSval=3899647692 TSecr=1939750905,0
367,8.239199,172.28.0.20,172.28.0.10,TCP,2962,"37376  >  5000 [PSH, ACK] Seq=462018 Ack=1 Win=64512 Len=2896 TSval=1939750981 TSecr=3899647668",2896
368,8.239239,172.28.0.20,172.28.0.10,TCP,1514,37376  >  5000 [ACK] Seq=464914 Ack=1 Win=64512 Len=1448 TSval=1939750981 TSecr=3899647668,1448
369,8.239279,172.28.0.10,172.28.0.20,TCP,66,5000  >  37376 [ACK] Seq=1 Ack=466362 Win=98304 Len=0 TSval=3899647768 TSecr=1939750981,0
370,8.26337,172.28.0.20,172.28.0.10,TCP,2962,"37376  >  5000 [PSH, ACK] Seq=466362 Ack=1 Win=64512 Len=2896 TSval=1939751005 TSecr=3899647692",2896
371,8.263395,172.28.0.20,172.28.0.10,TCP,1514,37376  >  5000 [ACK] Seq=469258 Ack=1 Win=64512 Len=1448 TSval=1939751005 TSecr=3899647692,1448
372,8.263422,172.28.0.10,172.28.0.20,TCP,66,5000  >  37376 [ACK] Seq=1 Ack=470706 Win=98304 Len=0 TSval=3899647792 TSecr=1939751005,0
373,8.339461,172.28.0.20,172.28.0.10,TCP,2962,"37376  >  5000 [PSH, ACK] Seq=470706 Ack=1 Win=64512 Len=2896 TSval=1939751081 TSecr=3899647768",2896
374,8.339501,172.28.0.20,172.28.0.10,TCP,1514,37376  >  5000 [ACK] Seq=473602 Ack=1 Win=64512 Len=1448 TSval=1939751081 TSecr=3899647768,1448
375,8.33954,172.28.0.10,172.28.0.20,TCP,66,5000  >  37376 [ACK] Seq=1 Ack=475050 Win=98304 Len=0 TSval=3899647869 TSecr=1939751081,0
376,8.363477,172.28.0.20,172.28.0.10,TCP,2962,"37376  >  5000 [PSH, ACK] Seq=475050 Ack=1 Win=64512 Len=2896 TSval=1939751106 TSecr=3899647792",2896
377,8.36352,172.28.0.20,172.28.0.10,TCP,1514,37376  >  5000 [ACK] Seq=477946 Ack=1 Win=64512 Len=1448 TSval=1939751106 TSecr=3899647792,1448
378,8.363556,172.28.0.10,172.28.0.20,TCP,66,5000  >  37376 [ACK] Seq=1 Ack=479394 Win=98304 Len=0 TSval=3899647893 TSecr=1939751106,0
379,8.439595,172.28.0.20,172.28.0.10,TCP,2962,"37376  >  5000 [PSH, ACK] Seq=479394 Ack=1 Win=64512 Len=2896 TSval=1939751182 TSecr=3899647869",2896
380,8.439633,172.28.0.20,172.28.0.10,TCP,2962,"37376  >  5000 [PSH, ACK] Seq=482290 Ack=1 Win=64512 Len=2896 TSval=1939751182 TSecr=3899647869",2896
381,8.439668,172.28.0.10,172.28.0.20,TCP,66,5000  >  37376 [ACK] Seq=1 Ack=485186 Win=98304 Len=0 TSval=3899647969 TSecr=1939751182,0
382,8.463729,172.28.0.20,172.28.0.10,TCP,2962,"37376  >  5000 [PSH, ACK] Seq=485186 Ack=1 Win=64512 Len=2896 TSval=1939751206 TSecr=3899647893",2896
383,8.463769,172.28.0.20,172.28.0.10,TCP,1514,37376  >  5000 [ACK] Seq=488082 Ack=1 Win=64512 Len=1448 TSval=1939751206 TSecr=3899647893,1448
384,8.463807,172.28.0.10,172.28.0.20,TCP,66,5000  >  37376 [ACK] Seq=1 Ack=489530 Win=98304 Len=0 TSval=3899647993 TSecr=1939751206,0
385,8.539811,172.28.0.20,172.28.0.10,TCP,2962,"37376  >  5000 [PSH, ACK] Seq=489530 Ack=1 Win=64512 Len=2896 TSval=1939751282 TSecr=3899647969",2896
386,8.539848,172.28.0.20,172.28.0.10,TCP,2962,"37376  >  5000 [PSH, ACK] Seq=492426 Ack=1 Win=64512 Len=2896 TSval=1939751282 TSecr=3899647969",2896
387,8.539889,172.28.0.10,172.28.0.20,TCP,66,5000  >  37376 [ACK] Seq=1 Ack=495322 Win=98304 Len=0 TSval=3899648069 TSecr=1939751282,0
388,8.563972,172.28.0.20,172.28.0.10,TCP,2962,"37376  >  5000 [PSH, ACK] Seq=495322 Ack=1 Win=64512 Len=2896 TSval=1939751306 TSecr=3899647993",2896
389,8.564011,172.28.0.20,172.28.0.10,TCP,1514,37376  >  5000 [ACK] Seq=498218 Ack=1 Win=64512 Len=1448 TSval=1939751306 TSecr=3899647993,1448
390,8.564049,172.28.0.10,172.28.0.20,TCP,66,5000  >  37376 [ACK] Seq=1 Ack=499666 Win=98304 Len=0 TSval=3899648093 TSecr=1939751306,0
391,8.639966,172.28.0.20,172.28.0.10,TCP,2962,"37376  >  5000 [PSH, ACK] Seq=499666 Ack=1 Win=64512 Len=2896 TSval=1939751382 TSecr=3899648069",2896
392,8.640004,172.28.0.20,172.28.0.10,TCP,2962,"37376  >  5000 [PSH, ACK] Seq=502562 Ack=1 Win=64512 Len=2896 TSval=1939751382 TSecr=3899648069",2896
393,8.640009,172.28.0.20,172.28.0.10,RSL,1514,unknown 12 ,0
394,8.640043,172.28.0.10,172.28.0.20,TCP,66,5000  >  37376 [ACK] Seq=1 Ack=506906 Win=98304 Len=0 TSval=3899648169 TSecr=1939751382,0
395,8.664216,172.28.0.20,172.28.0.10,TCP,2962,"37376  >  5000 [PSH, ACK] Seq=506906 Ack=1 Win=64512 Len=2896 TSval=1939751406 TSecr=3899648093",2896
396,8.664255,172.28.0.20,172.28.0.10,RSL,1514,[Malformed Packet],0
397,8.664295,172.28.0.10,172.28.0.20,TCP,66,5000  >  37376 [ACK] Seq=1 Ack=511250 Win=98304 Len=0 TSval=3899648193 TSecr=1939751406,0
398,8.740113,172.28.0.20,172.28.0.10,TCP,922,"37376  >  5000 [PSH, ACK] Seq=511250 Ack=1 Win=64512 Len=856 TSval=1939751482 TSecr=3899648169",856
399,8.740179,172.28.0.10,172.28.0.20,TCP,66,5000  >  37376 [ACK] Seq=1 Ack=512106 Win=98304 Len=0 TSval=3899648269 TSecr=1939751482,0
400,8.740592,172.28.0.10,172.28.0.20,TCP,69,"5000  >  37376 [PSH, ACK] Seq=1 Ack=512106 Win=98304 Len=3 TSval=3899648270 TSecr=1939751482",3
401,8.840623,172.28.0.20,172.28.0.10,TCP,66,37376  >  5000 [ACK] Seq=512106 Ack=4 Win=64512 Len=0 TSval=1939751583 TSecr=3899648270,0
402,8.840744,172.28.0.20,172.28.0.10,TCP,66,"37376  >  5000 [FIN, ACK] Seq=512106 Ack=4 Win=64512 Len=0 TSval=1939751583 TSecr=3899648270",0
403,8.884453,172.28.0.10,172.28.0.20,TCP,66,5000  >  37376 [ACK] Seq=4 Ack=512107 Win=98304 Len=0 TSval=3899648414 TSecr=1939751583,0
