"No.","Time","Source","Destination","Protocol","Length","Info"
"4","0.010182","172.28.0.20","172.28.0.10","TCP","171","51854  >  5000 [PSH, ACK] Seq=1 Ack=1 Win=64512 Len=105 TSval=1939212684 TSecr=3899109371"
"6","0.010249","172.28.0.20","172.28.0.10","RSL","2962","[Malformed Packet]"
"8","0.010263","172.28.0.20","172.28.0.10","TCP","2962","51854  >  5000 [PSH, ACK] Seq=3002 Ack=1 Win=64512 Len=2896 TSval=1939212684 TSecr=3899109371"
"10","0.010265","172.28.0.20","172.28.0.10","TCP","2962","51854  >  5000 [PSH, ACK] Seq=5898 Ack=1 Win=64512 Len=2896 TSval=1939212684 TSecr=3899109371"
"12","0.010268","172.28.0.20","172.28.0.10","TCP","2962","51854  >  5000 [PSH, ACK] Seq=8794 Ack=1 Win=64512 Len=2896 TSval=1939212684 TSecr=3899109371"
"14","0.010270","172.28.0.20","172.28.0.10","TCP","1514","51854  >  5000 [ACK] Seq=11690 Ack=1 Win=64512 Len=1448 TSval=1939212684 TSecr=3899109371"
"16","0.020244","172.28.0.20","172.28.0.10","TCP","2962","51854  >  5000 [PSH, ACK] Seq=13138 Ack=1 Win=64512 Len=2896 TSval=1939212694 TSecr=3899109381"
"18","0.020293","172.28.0.20","172.28.0.10","TCP","2962","51854  >  5000 [PSH, ACK] Seq=16034 Ack=1 Win=64512 Len=2896 TSval=1939212694 TSecr=3899109381"
"20","0.020298","172.28.0.20","172.28.0.10","TCP","2962","51854  >  5000 [PSH, ACK] Seq=18930 Ack=1 Win=64512 Len=2896 TSval=1939212694 TSecr=3899109381"
"22","0.020301","172.28.0.20","172.28.0.10","TCP","2962","51854  >  5000 [PSH, ACK] Seq=21826 Ack=1 Win=64512 Len=2896 TSval=1939212694 TSecr=3899109381"
"24","0.020304","172.28.0.20","172.28.0.10","TCP","2962","51854  >  5000 [PSH, ACK] Seq=24722 Ack=1 Win=64512 Len=2896 TSval=1939212694 TSecr=3899109381"
"26","0.020308","172.28.0.20","172.28.0.10","TCP","2962","51854  >  5000 [PSH, ACK] Seq=27618 Ack=1 Win=64512 Len=2896 TSval=1939212694 TSecr=3899109381"
"28","0.020311","172.28.0.20","172.28.0.10","TCP","2962","51854  >  5000 [PSH, ACK] Seq=30514 Ack=1 Win=64512 Len=2896 TSval=1939212694 TSecr=3899109381"
"30","0.020314","172.28.0.20","172.28.0.10","RSL","2962","ERROR REPORT "
"32","0.020318","172.28.0.20","172.28.0.10","TCP","2962","51854  >  5000 [PSH, ACK] Seq=36306 Ack=1 Win=64512 Len=2896 TSval=1939212694 TSecr=3899109381"
"34","0.020321","172.28.0.20","172.28.0.10","TCP","2962","51854  >  5000 [PSH, ACK] Seq=39202 Ack=1 Win=64512 Len=2896 TSval=1939212694 TSecr=3899109381"
"36","0.030330","172.28.0.20","172.28.0.10","RSL","4410","PAGING Huawei extension "
"38","0.030368","172.28.0.20","172.28.0.10","RSL","1514","[Malformed Packet]"
"40","0.030403","172.28.0.20","172.28.0.10","TCP","4410","51854  >  5000 [PSH, ACK] Seq=47890 Ack=1 Win=64512 Len=4344 TSval=1939212704 TSecr=3899109391"
"42","0.030407","172.28.0.20","172.28.0.10","TCP","1514","51854  >  5000 [ACK] Seq=52234 Ack=1 Win=64512 Len=1448 TSval=1939212704 TSecr=3899109391"
"43","0.030410","172.28.0.20","172.28.0.10","TCP","4410","51854  >  5000 [PSH, ACK] Seq=53682 Ack=1 Win=64512 Len=4344 TSval=1939212704 TSecr=3899109391"
"44","0.030411","172.28.0.20","172.28.0.10","TCP","1514","51854  >  5000 [ACK] Seq=58026 Ack=1 Win=64512 Len=1448 TSval=1939212704 TSecr=3899109391"
"45","0.030413","172.28.0.20","172.28.0.10","TCP","5858","51854  >  5000 [PSH, ACK] Seq=59474 Ack=1 Win=64512 Len=5792 TSval=1939212704 TSecr=3899109391"
"46","0.030415","172.28.0.20","172.28.0.10","TCP","5858","51854  >  5000 [PSH, ACK] Seq=65266 Ack=1 Win=64512 Len=5792 TSval=1939212704 TSecr=3899109391"
"47","0.030417","172.28.0.20","172.28.0.10","TCP","5858","51854  >  5000 [PSH, ACK] Seq=71058 Ack=1 Win=64512 Len=5792 TSval=1939212704 TSecr=3899109391"
"48","0.030419","172.28.0.20","172.28.0.10","TCP","5858","51854  >  5000 [PSH, ACK] Seq=76850 Ack=1 Win=64512 Len=5792 TSval=1939212704 TSecr=3899109391"
"49","0.030421","172.28.0.20","172.28.0.10","TCP","5858","51854  >  5000 [PSH, ACK] Seq=82642 Ack=1 Win=64512 Len=5792 TSval=1939212704 TSecr=3899109391"
"50","0.030423","172.28.0.20","172.28.0.10","RSL","5858","PAGING Huawei extension "
"51","0.030426","172.28.0.20","172.28.0.10","TCP","5858","51854  >  5000 [PSH, ACK] Seq=94226 Ack=1 Win=64512 Len=5792 TSval=1939212704 TSecr=3899109391"
"53","0.040441","172.28.0.20","172.28.0.10","TCP","8754","51854  >  5000 [PSH, ACK] Seq=100018 Ack=1 Win=64512 Len=8688 TSval=1939212714 TSecr=3899109401"
"54","0.040489","172.28.0.20","172.28.0.10","TCP","11650","51854  >  5000 [PSH, ACK] Seq=108706 Ack=1 Win=64512 Len=11584 TSval=1939212714 TSecr=3899109401"
"55","0.040512","172.28.0.20","172.28.0.10","TCP","20338","51854  >  5000 [PSH, ACK] Seq=120290 Ack=1 Win=64512 Len=20272 TSval=1939212714 TSecr=3899109401"
"56","0.040517","172.28.0.20","172.28.0.10","TCP","20338","51854  >  5000 [PSH, ACK] Seq=140562 Ack=1 Win=64512 Len=20272 TSval=1939212714 TSecr=3899109401"
"57","0.040524","172.28.0.20","172.28.0.10","TCP","20338","51854  >  5000 [PSH, ACK] Seq=160834 Ack=1 Win=64512 Len=20272 TSval=1939212714 TSecr=3899109401"
"58","0.040528","172.28.0.20","172.28.0.10","RSL","14210","[TCP Window Full] PAGING Huawei extension unknown 0x2e "
"60","0.050774","172.28.0.20","172.28.0.10","TCP","37714","51854  >  5000 [PSH, ACK] Seq=195250 Ack=1 Win=64512 Len=37648 TSval=1939212724 TSecr=3899109411"
"61","0.050820","172.28.0.20","172.28.0.10","TCP","34098","[TCP Window Full] 51854  >  5000 [PSH, ACK] Seq=232898 Ack=1 Win=64512 Len=34032 TSval=1939212724 TSecr=3899109411"
"63","0.061012","172.28.0.20","172.28.0.10","TCP","37714","51854  >  5000 [PSH, ACK] Seq=266930 Ack=1 Win=64512 Len=37648 TSval=1939212735 TSecr=3899109422"
"65","0.061070","172.28.0.20","172.28.0.10","TCP","37714","51854  >  5000 [PSH, ACK] Seq=304578 Ack=1 Win=64512 Len=37648 TSval=1939212735 TSecr=3899109422"
"66","0.061079","172.28.0.20","172.28.0.10","TCP","20002","51854  >  5000 [PSH, ACK] Seq=342226 Ack=1 Win=64512 Len=19936 TSval=1939212735 TSecr=3899109422"
"68","0.071247","172.28.0.20","172.28.0.10","TCP","37714","51854  >  5000 [PSH, ACK] Seq=362162 Ack=1 Win=64512 Len=37648 TSval=1939212745 TSecr=3899109432"
"70","0.071305","172.28.0.20","172.28.0.10","TCP","37714","51854  >  5000 [PSH, ACK] Seq=399810 Ack=1 Win=64512 Len=37648 TSval=1939212745 TSecr=3899109432"
"71","0.071317","172.28.0.20","172.28.0.10","TCP","49298","51854  >  5000 [PSH, ACK] Seq=437458 Ack=1 Win=64512 Len=49232 TSval=1939212745 TSecr=3899109432"
"72","0.071326","172.28.0.20","172.28.0.10","TCP","11730","51854  >  5000 [PSH, ACK] Seq=486690 Ack=1 Win=64512 Len=11664 TSval=1939212745 TSecr=3899109432"
"74","0.081398","172.28.0.20","172.28.0.10","TCP","13098","51854  >  5000 [PSH, ACK] Seq=498354 Ack=1 Win=64512 Len=13032 TSval=1939212755 TSecr=3899109442"
"76","0.081480","172.28.0.20","172.28.0.10","TCP","786","51854  >  5000 [PSH, ACK] Seq=511386 Ack=1 Win=64512 Len=720 TSval=1939212755 TSecr=3899109442"
"78","0.081871","172.28.0.10","172.28.0.20","TCP","69","5000  >  51854 [PSH, ACK] Seq=1 Ack=512106 Win=169984 Len=3 TSval=3899109453 TSecr=1939212755"
