"No.","Time","Source","Destination","Protocol","Length","Info"
"1","0.000000","172.28.0.20","172.28.0.10","TCP","74","55206  >  5000 [SYN] Seq=0 Win=64240 Len=0 MSS=1460 SACK_PERM TSval=1939598059 TSecr=0 WS=1024"
"2","0.000041","172.28.0.10","172.28.0.20","TCP","74","5000  >  55206 [SYN, ACK] Seq=0 Ack=1 Win=65160 Len=0 MSS=1460 SACK_PERM TSval=3899494796 TSecr=1939598059 WS=1024"
"3","0.050212","172.28.0.20","172.28.0.10","TCP","66","55206  >  5000 [ACK] Seq=1 Ack=1 Win=64512 Len=0 TSval=1939598109 TSecr=3899494796"
"4","0.050268","172.28.0.20","172.28.0.10","TCP","171","55206  >  5000 [PSH, ACK] Seq=1 Ack=1 Win=64512 Len=105 TSval=1939598109 TSecr=3899494796"
"5","0.050284","172.28.0.10","172.28.0.20","TCP","66","5000  >  55206 [ACK] Seq=1 Ack=106 Win=65536 Len=0 TSval=3899494846 TSecr=1939598109"
"6","0.050316","172.28.0.20","172.28.0.10","RSL","2962","[Malformed Packet]"
"7","0.050322","172.28.0.10","172.28.0.20","TCP","66","5000  >  55206 [ACK] Seq=1 Ack=3002 Win=71680 Len=0 TSval=3899494847 TSecr=1939598109"
"8","0.050324","172.28.0.20","172.28.0.10","TCP","2962","55206  >  5000 [PSH, ACK] Seq=3002 Ack=1 Win=64512 Len=2896 TSval=1939598109 TSecr=3899494796"
"9","0.050328","172.28.0.10","172.28.0.20","TCP","66","5000  >  55206 [ACK] Seq=1 Ack=5898 Win=77824 Len=0 TSval=3899494847 TSecr=1939598109"
"10","0.050330","172.28.0.20","172.28.0.10","TCP","2962","55206  >  5000 [PSH, ACK] Seq=5898 Ack=1 Win=64512 Len=2896 TSval=1939598109 TSecr=3899494796"
"11","0.050336","172.28.0.10","172.28.0.20","TCP","66","5000  >  55206 [ACK] Seq=1 Ack=8794 Win=82944 Len=0 TSval=3899494847 TSecr=1939598109"
"12","0.050338","172.28.0.20","172.28.0.10","TCP","1514","[TCP Previous segment not captured] 55206  >  5000 [ACK] Seq=11690 Ack=1 Win=64512 Len=1448 TSval=1939598109 TSecr=3899494796"
"13","0.050343","172.28.0.10","172.28.0.20","TCP","78","[TCP Window Update] 5000  >  55206 [ACK] Seq=1 Ack=8794 Win=86016 Len=0 TSval=3899494847 TSecr=1939598109 SLE=11690 SRE=13138"
"14","0.050593","172.28.0.10","172.28.0.20","TCP","66","5000  >  51854 [FIN, ACK] Seq=1 Ack=1 Win=166 Len=0 TSval=3899494847 TSecr=1939212766"
"15","0.100338","172.28.0.20","172.28.0.10","TCP","2962","55206  >  5000 [PSH, ACK] Seq=13138 Ack=1 Win=64512 Len=2896 TSval=1939598160 TSecr=3899494846"
"16","0.100391","172.28.0.10","172.28.0.20","TCP","78","[TCP Window Update] 5000  >  55206 [ACK] Seq=1 Ack=8794 Win=92160 Len=0 TSval=3899494897 TSecr=1939598109 SLE=11690 SRE=16034"
"17","0.100452","172.28.0.20","172.28.0.10","TCP","2962","55206  >  5000 [PSH, ACK] Seq=16034 Ack=1 Win=64512 Len=2896 TSval=1939598160 TSecr=3899494847"
"18","0.100460","172.28.0.10","172.28.0.20","TCP","78","[TCP Dup ACK 11#1] 5000  >  55206 [ACK] Seq=1 Ack=8794 Win=92160 Len=0 TSval=3899494897 TSecr=1939598109 SLE=11690 SRE=18930"
"19","0.100462","172.28.0.20","172.28.0.10","TCP","2962","55206  >  5000 [PSH, ACK] Seq=18930 Ack=1 Win=64512 Len=2896 TSval=1939598160 TSecr=3899494847"
"20","0.100466","172.28.0.10","172.28.0.20","TCP","78","[TCP Dup ACK 11#2] 5000  >  55206 [ACK] Seq=1 Ack=8794 Win=92160 Len=0 TSval=3899494897 TSecr=1939598109 SLE=11690 SRE=21826"
"21","0.100468","172.28.0.20","172.28.0.10","TCP","2962","55206  >  5000 [PSH, ACK] Seq=21826 Ack=1 Win=64512 Len=2896 TSval=1939598160 TSecr=3899494847"
"22","0.100472","172.28.0.10","172.28.0.20","TCP","78","[TCP Dup ACK 11#3] 5000  >  55206 [ACK] Seq=1 Ack=8794 Win=92160 Len=0 TSval=3899494897 TSecr=1939598109 SLE=11690 SRE=24722"
"23","0.100474","172.28.0.20","172.28.0.10","TCP","2962","55206  >  5000 [PSH, ACK] Seq=24722 Ack=1 Win=64512 Len=2896 TSval=1939598160 TSecr=3899494847"
"24","0.100478","172.28.0.10","172.28.0.20","TCP","78","[TCP Dup ACK 11#4] 5000  >  55206 [ACK] Seq=1 Ack=8794 Win=92160 Len=0 TSval=3899494897 TSecr=1939598109 SLE=11690 SRE=27618"
"25","0.100480","172.28.0.20","172.28.0.10","TCP","2962","55206  >  5000 [PSH, ACK] Seq=27618 Ack=1 Win=64512 Len=2896 TSval=1939598160 TSecr=3899494847"
"26","0.100484","172.28.0.10","172.28.0.20","TCP","78","[TCP Dup ACK 11#5] 5000  >  55206 [ACK] Seq=1 Ack=8794 Win=92160 Len=0 TSval=3899494897 TSecr=1939598109 SLE=11690 SRE=30514"
"27","0.100486","172.28.0.20","172.28.0.10","TCP","2962","55206  >  5000 [PSH, ACK] Seq=30514 Ack=1 Win=64512 Len=2896 TSval=1939598160 TSecr=3899494847"
"28","0.100490","172.28.0.10","172.28.0.20","TCP","78","[TCP Dup ACK 11#6] 5000  >  55206 [ACK] Seq=1 Ack=8794 Win=92160 Len=0 TSval=3899494897 TSecr=1939598109 SLE=11690 SRE=33410"
"29","0.100625","172.28.0.20","172.28.0.10","TCP","54","51854  >  5000 [RST] Seq=1 Win=0 Len=0"
"30","0.116369","172.28.0.20","172.28.0.10","TCP","1514","[TCP Fast Retransmission] 55206  >  5000 [ACK] Seq=8794 Ack=1 Win=64512 Len=1448 TSval=1939598176 TSecr=3899494847"
"31","0.116400","172.28.0.10","172.28.0.20","TCP","78","5000  >  55206 [ACK] Seq=1 Ack=10242 Win=91136 Len=0 TSval=3899494913 TSecr=1939598176 SLE=11690 SRE=33410"
"32","0.150577","172.28.0.20","172.28.0.10","TCP","1514","[TCP Out-Of-Order] 55206  >  5000 [ACK] Seq=10242 Ack=1 Win=64512 Len=1448 TSval=1939598210 TSecr=3899494897"
"33","0.150620","172.28.0.10","172.28.0.20","TCP","66","5000  >  55206 [ACK] Seq=1 Ack=33410 Win=79872 Len=0 TSval=3899494947 TSecr=1939598210"
"34","0.150625","172.28.0.20","172.28.0.10","RSL","2962","ERROR REPORT "
"35","0.150631","172.28.0.10","172.28.0.20","TCP","66","5000  >  55206 [ACK] Seq=1 Ack=36306 Win=77824 Len=0 TSval=3899494947 TSecr=1939598210"
"36","0.150633","172.28.0.20","172.28.0.10","TCP","1514","55206  >  5000 [ACK] Seq=36306 Ack=1 Win=64512 Len=1448 TSval=1939598210 TSecr=3899494897"
"37","0.150637","172.28.0.10","172.28.0.20","TCP","66","5000  >  55206 [ACK] Seq=1 Ack=37754 Win=76800 Len=0 TSval=3899494947 TSecr=1939598210"
"38","0.150639","172.28.0.20","172.28.0.10","RSL","2962","DELETE INDication (CCCH) (SM) "
"39","0.150644","172.28.0.10","172.28.0.20","TCP","66","5000  >  55206 [ACK] Seq=1 Ack=40650 Win=74752 Len=0 TSval=3899494947 TSecr=1939598210"
"40","0.150646","172.28.0.20","172.28.0.10","TCP","2962","[TCP Previous segment not captured] 55206  >  5000 [PSH, ACK] Seq=43546 Ack=1 Win=64512 Len=2896 TSval=1939598210 TSecr=3899494897"
"41","0.150650","172.28.0.10","172.28.0.20","TCP","78","[TCP Dup ACK 39#1] 5000  >  55206 [ACK] Seq=1 Ack=40650 Win=74752 Len=0 TSval=3899494947 TSecr=1939598210 SLE=43546 SRE=46442"
"42","0.166610","172.28.0.20","172.28.0.10","RSL","1514","[Malformed Packet]"
"43","0.166637","172.28.0.10","172.28.0.20","TCP","78","[TCP Window Update] 5000  >  55206 [ACK] Seq=1 Ack=40650 Win=94208 Len=0 TSval=3899494963 TSecr=1939598210 SLE=43546 SRE=47890"
"44","0.200732","172.28.0.20","172.28.0.10","TCP","1514","55206  >  5000 [ACK] Seq=47890 Ack=1 Win=64512 Len=1448 TSval=1939598260 TSecr=3899494947"
"45","0.200767","172.28.0.10","172.28.0.20","TCP","78","[TCP Dup ACK 39#2] 5000  >  55206 [ACK] Seq=1 Ack=40650 Win=94208 Len=0 TSval=3899494997 TSecr=1939598210 SLE=43546 SRE=49338"
"46","0.200770","172.28.0.20","172.28.0.10","TCP","2962","55206  >  5000 [PSH, ACK] Seq=49338 Ack=1 Win=64512 Len=2896 TSval=1939598260 TSecr=3899494947"
"47","0.200775","172.28.0.10","172.28.0.20","TCP","78","[TCP Dup ACK 39#3] 5000  >  55206 [ACK] Seq=1 Ack=40650 Win=94208 Len=0 TSval=3899494997 TSecr=1939598210 SLE=43546 SRE=52234"
"48","0.200777","172.28.0.20","172.28.0.10","TCP","2962","55206  >  5000 [PSH, ACK] Seq=52234 Ack=1 Win=64512 Len=2896 TSval=1939598260 TSecr=3899494947"
"49","0.200781","172.28.0.10","172.28.0.20","TCP","78","[TCP Dup ACK 39#4] 5000  >  55206 [ACK] Seq=1 Ack=40650 Win=94208 Len=0 TSval=3899494997 TSecr=1939598210 SLE=43546 SRE=55130"
"50","0.200825","172.28.0.20","172.28.0.10","TCP","2962","55206  >  5000 [PSH, ACK] Seq=55130 Ack=1 Win=64512 Len=2896 TSval=1939598260 TSecr=3899494947"
"51","0.200829","172.28.0.10","172.28.0.20","TCP","78","[TCP Dup ACK 39#5] 5000  >  55206 [ACK] Seq=1 Ack=40650 Win=94208 Len=0 TSval=3899494997 TSecr=1939598210 SLE=43546 SRE=58026"
"52","0.216368","172.28.0.20","172.28.0.10","TCP","1514","[TCP Fast Retransmission] 55206  >  5000 [ACK] Seq=40650 Ack=1 Win=64512 Len=1448 TSval=1939598276 TSecr=3899494947"
"53","0.216401","172.28.0.10","172.28.0.20","TCP","78","5000  >  55206 [ACK] Seq=1 Ack=42098 Win=93184 Len=0 TSval=3899495013 TSecr=1939598276 SLE=43546 SRE=58026"
"54","0.216666","172.28.0.20","172.28.0.10","TCP","1514","[TCP Out-Of-Order] 55206  >  5000 [ACK] Seq=42098 Ack=1 Win=64512 Len=1448 TSval=1939598276 TSecr=3899494963"
"55","0.216674","172.28.0.10","172.28.0.20","TCP","66","5000  >  55206 [ACK] Seq=1 Ack=58026 Win=84992 Len=0 TSval=3899495013 TSecr=1939598276"
"56","0.250873","172.28.0.20","172.28.0.10","TCP","1514","55206  >  5000 [ACK] Seq=58026 Ack=1 Win=64512 Len=1448 TSval=1939598310 TSecr=3899494997"
"57","0.250913","172.28.0.10","172.28.0.20","TCP","66","5000  >  55206 [ACK] Seq=1 Ack=59474 Win=97280 Len=0 TSval=3899495047 TSecr=1939598310"
"58","0.250917","172.28.0.20","172.28.0.10","TCP","2962","55206  >  5000 [PSH, ACK] Seq=59474 Ack=1 Win=64512 Len=2896 TSval=1939598310 TSecr=3899494997"
"59","0.250922","172.28.0.20","172.28.0.10","TCP","2962","55206  >  5000 [PSH, ACK] Seq=62370 Ack=1 Win=64512 Len=2896 TSval=1939598310 TSecr=3899494997"
"60","0.251016","172.28.0.10","172.28.0.20","TCP","66","5000  >  55206 [ACK] Seq=1 Ack=65266 Win=97280 Len=0 TSval=3899495047 TSecr=1939598310"
"61","0.266455","172.28.0.20","172.28.0.10","TCP","1514","55206  >  5000 [ACK] Seq=65266 Ack=1 Win=64512 Len=1448 TSval=1939598326 TSecr=3899495013"
"62","0.300985","172.28.0.20","172.28.0.10","TCP","1514","[TCP Previous segment not captured] 55206  >  5000 [ACK] Seq=68162 Ack=1 Win=64512 Len=1448 TSval=1939598360 TSecr=3899495047"
"63","0.301016","172.28.0.10","172.28.0.20","TCP","78","5000  >  55206 [ACK] Seq=1 Ack=66714 Win=97280 Len=0 TSval=3899495097 TSecr=1939598326 SLE=68162 SRE=69610"
"64","0.301055","172.28.0.20","172.28.0.10","TCP","2962","55206  >  5000 [PSH, ACK] Seq=69610 Ack=1 Win=64512 Len=2896 TSval=1939598360 TSecr=3899495047"
"65","0.301061","172.28.0.10","172.28.0.20","TCP","78","[TCP Dup ACK 63#1] 5000  >  55206 [ACK] Seq=1 Ack=66714 Win=97280 Len=0 TSval=3899495097 TSecr=1939598326 SLE=68162 SRE=72506"
"66","0.301062","172.28.0.20","172.28.0.10","TCP","2962","55206  >  5000 [PSH, ACK] Seq=72506 Ack=1 Win=64512 Len=2896 TSval=1939598360 TSecr=3899495047"
"67","0.301066","172.28.0.10","172.28.0.20","TCP","78","[TCP Dup ACK 63#2] 5000  >  55206 [ACK] Seq=1 Ack=66714 Win=97280 Len=0 TSval=3899495097 TSecr=1939598326 SLE=68162 SRE=75402"
"68","0.351185","172.28.0.20","172.28.0.10","TCP","2962","55206  >  5000 [PSH, ACK] Seq=75402 Ack=1 Win=64512 Len=2896 TSval=1939598410 TSecr=3899495097"
"69","0.351222","172.28.0.10","172.28.0.20","TCP","78","[TCP Dup ACK 63#3] 5000  >  55206 [ACK] Seq=1 Ack=66714 Win=97280 Len=0 TSval=3899495147 TSecr=1939598326 SLE=68162 SRE=78298"
"70","0.351226","172.28.0.20","172.28.0.10","TCP","1514","[TCP Fast Retransmission] 55206  >  5000 [ACK] Seq=66714 Ack=1 Win=64512 Len=1448 TSval=1939598410 TSecr=3899495097"
"71","0.351242","172.28.0.10","172.28.0.20","TCP","66","5000  >  55206 [ACK] Seq=1 Ack=78298 Win=89088 Len=0 TSval=3899495147 TSecr=1939598410"
"72","0.351243","172.28.0.20","172.28.0.10","TCP","2962","55206  >  5000 [PSH, ACK] Seq=78298 Ack=1 Win=64512 Len=2896 TSval=1939598410 TSecr=3899495097"
"73","0.351368","172.28.0.10","172.28.0.20","TCP","66","5000  >  55206 [ACK] Seq=1 Ack=81194 Win=98304 Len=0 TSval=3899495148 TSecr=1939598410"
"74","0.401318","172.28.0.20","172.28.0.10","TCP","2962","55206  >  5000 [PSH, ACK] Seq=81194 Ack=1 Win=64512 Len=2896 TSval=1939598460 TSecr=3899495147"
"75","0.401361","172.28.0.20","172.28.0.10","RSL","1514","DELETE INDication (CCCH) (SM) "
"76","0.401403","172.28.0.20","172.28.0.10","TCP","2962","55206  >  5000 [PSH, ACK] Seq=85538 Ack=1 Win=64512 Len=2896 TSval=1939598461 TSecr=3899495148"
"77","0.401412","172.28.0.10","172.28.0.20","TCP","66","5000  >  55206 [ACK] Seq=1 Ack=85538 Win=98304 Len=0 TSval=3899495198 TSecr=1939598460"
"78","0.401592","172.28.0.10","172.28.0.20","TCP","66","5000  >  55206 [ACK] Seq=1 Ack=88434 Win=98304 Len=0 TSval=3899495198 TSecr=1939598461"
"79","0.451585","172.28.0.20","172.28.0.10","RSL","2962","PAGING Huawei extension "
"80","0.451628","172.28.0.20","172.28.0.10","TCP","2962","55206  >  5000 [PSH, ACK] Seq=91330 Ack=1 Win=64512 Len=2896 TSval=1939598511 TSecr=3899495198"
"81","0.451652","172.28.0.20","172.28.0.10","TCP","2962","55206  >  5000 [PSH, ACK] Seq=94226 Ack=1 Win=64512 Len=2896 TSval=1939598511 TSecr=3899495198"
"82","0.451686","172.28.0.10","172.28.0.20","TCP","66","5000  >  55206 [ACK] Seq=1 Ack=97122 Win=98304 Len=0 TSval=3899495248 TSecr=1939598511"
"83","0.501843","172.28.0.20","172.28.0.10","TCP","2962","55206  >  5000 [PSH, ACK] Seq=97122 Ack=1 Win=64512 Len=2896 TSval=1939598561 TSecr=3899495248"
"84","0.501883","172.28.0.20","172.28.0.10","TCP","2962","55206  >  5000 [PSH, ACK] Seq=100018 Ack=1 Win=64512 Len=2896 TSval=1939598561 TSecr=3899495248"
"85","0.501886","172.28.0.20","172.28.0.10","TCP","2962","55206  >  5000 [PSH, ACK] Seq=102914 Ack=1 Win=64512 Len=2896 TSval=1939598561 TSecr=3899495248"
"86","0.501933","172.28.0.10","172.28.0.20","TCP","66","5000  >  55206 [ACK] Seq=1 Ack=105810 Win=98304 Len=0 TSval=3899495298 TSecr=1939598561"
"87","0.552114","172.28.0.20","172.28.0.10","TCP","2962","55206  >  5000 [PSH, ACK] Seq=105810 Ack=1 Win=64512 Len=2896 TSval=1939598611 TSecr=3899495298"
"88","0.552155","172.28.0.20","172.28.0.10","TCP","2962","55206  >  5000 [PSH, ACK] Seq=108706 Ack=1 Win=64512 Len=2896 TSval=1939598611 TSecr=3899495298"
"89","0.552159","172.28.0.20","172.28.0.10","TCP","2962","55206  >  5000 [PSH, ACK] Seq=111602 Ack=1 Win=64512 Len=2896 TSval=1939598611 TSecr=3899495298"
"90","0.552200","172.28.0.10","172.28.0.20","TCP","66","5000  >  55206 [ACK] Seq=1 Ack=114498 Win=98304 Len=0 TSval=3899495348 TSecr=1939598611"
"91","0.602247","172.28.0.20","172.28.0.10","TCP","2962","55206  >  5000 [PSH, ACK] Seq=114498 Ack=1 Win=64512 Len=2896 TSval=1939598661 TSecr=3899495348"
"92","0.602264","172.28.0.20","172.28.0.10","TCP","2962","55206  >  5000 [PSH, ACK] Seq=117394 Ack=1 Win=64512 Len=2896 TSval=1939598661 TSecr=3899495348"
"93","0.602266","172.28.0.20","172.28.0.10","TCP","2962","55206  >  5000 [PSH, ACK] Seq=120290 Ack=1 Win=64512 Len=2896 TSval=1939598661 TSecr=3899495348"
"94","0.602269","172.28.0.20","172.28.0.10","TCP","2962","55206  >  5000 [PSH, ACK] Seq=123186 Ack=1 Win=64512 Len=2896 TSval=1939598661 TSecr=3899495348"
"95","0.602287","172.28.0.10","172.28.0.20","TCP","66","5000  >  55206 [ACK] Seq=1 Ack=126082 Win=98304 Len=0 TSval=3899495398 TSecr=1939598661"
"96","0.652446","172.28.0.20","172.28.0.10","RSL","2962","ERROR REPORT "
"97","0.652486","172.28.0.20","172.28.0.10","TCP","2962","55206  >  5000 [PSH, ACK] Seq=128978 Ack=1 Win=64512 Len=2896 TSval=1939598712 TSecr=3899495398"
"98","0.652490","172.28.0.20","172.28.0.10","TCP","2962","55206  >  5000 [PSH, ACK] Seq=131874 Ack=1 Win=64512 Len=2896 TSval=1939598712 TSecr=3899495398"
"99","0.652493","172.28.0.20","172.28.0.10","RSL","2962","PAGING Huawei extension "
"100","0.652539","172.28.0.10","172.28.0.20","TCP","66","5000  >  55206 [ACK] Seq=1 Ack=137666 Win=98304 Len=0 TSval=3899495449 TSecr=1939598712"
"101","0.702594","172.28.0.20","172.28.0.10","TCP","2962","55206  >  5000 [PSH, ACK] Seq=137666 Ack=1 Win=64512 Len=2896 TSval=1939598762 TSecr=3899495449"
"102","0.702628","172.28.0.20","172.28.0.10","TCP","2962","55206  >  5000 [PSH, ACK] Seq=140562 Ack=1 Win=64512 Len=2896 TSval=1939598762 TSecr=3899495449"
"103","0.702632","172.28.0.20","172.28.0.10","TCP","2962","55206  >  5000 [PSH, ACK] Seq=143458 Ack=1 Win=64512 Len=2896 TSval=1939598762 TSecr=3899495449"
"104","0.702634","172.28.0.20","172.28.0.10","TCP","2962","55206  >  5000 [PSH, ACK] Seq=146354 Ack=1 Win=64512 Len=2896 TSval=1939598762 TSecr=3899495449"
"105","0.702662","172.28.0.10","172.28.0.20","TCP","66","5000  >  55206 [ACK] Seq=1 Ack=149250 Win=98304 Len=0 TSval=3899495499 TSecr=1939598762"
"106","0.752742","172.28.0.20","172.28.0.10","TCP","2962","55206  >  5000 [PSH, ACK] Seq=149250 Ack=1 Win=64512 Len=2896 TSval=1939598812 TSecr=3899495499"
"107","0.752776","172.28.0.20","172.28.0.10","TCP","2962","55206  >  5000 [PSH, ACK] Seq=152146 Ack=1 Win=64512 Len=2896 TSval=1939598812 TSecr=3899495499"
"108","0.752780","172.28.0.20","172.28.0.10","TCP","2962","55206  >  5000 [PSH, ACK] Seq=155042 Ack=1 Win=64512 Len=2896 TSval=1939598812 TSecr=3899495499"
"109","0.752782","172.28.0.20","172.28.0.10","TCP","2962","55206  >  5000 [PSH, ACK] Seq=157938 Ack=1 Win=64512 Len=2896 TSval=1939598812 TSecr=3899495499"
"110","0.752812","172.28.0.10","172.28.0.20","TCP","66","5000  >  55206 [ACK] Seq=1 Ack=160834 Win=98304 Len=0 TSval=3899495549 TSecr=1939598812"
"111","0.802975","172.28.0.20","172.28.0.10","TCP","2962","55206  >  5000 [PSH, ACK] Seq=160834 Ack=1 Win=64512 Len=2896 TSval=1939598862 TSecr=3899495549"
"112","0.803014","172.28.0.20","172.28.0.10","TCP","2962","[TCP Previous segment not captured] 55206  >  5000 [PSH, ACK] Seq=166626 Ack=1 Win=64512 Len=2896 TSval=1939598862 TSecr=3899495549"
"113","0.803030","172.28.0.10","172.28.0.20","TCP","78","5000  >  55206 [ACK] Seq=1 Ack=163730 Win=96256 Len=0 TSval=3899495599 TSecr=1939598862 SLE=166626 SRE=169522"
"114","0.803033","172.28.0.20","172.28.0.10","TCP","2962","55206  >  5000 [PSH, ACK] Seq=169522 Ack=1 Win=64512 Len=2896 TSval=1939598862 TSecr=3899495549"
"115","0.803038","172.28.0.10","172.28.0.20","TCP","78","[TCP Dup ACK 113#1] 5000  >  55206 [ACK] Seq=1 Ack=163730 Win=96256 Len=0 TSval=3899495599 TSecr=1939598862 SLE=166626 SRE=172418"
"116","0.803040","172.28.0.20","172.28.0.10","RSL","2962","ERROR REPORT "
"117","0.803044","172.28.0.10","172.28.0.20","TCP","78","[TCP Dup ACK 113#2] 5000  >  55206 [ACK] Seq=1 Ack=163730 Win=96256 Len=0 TSval=3899495599 TSecr=1939598862 SLE=166626 SRE=175314"
"118","0.853106","172.28.0.20","172.28.0.10","TCP","2962","55206  >  5000 [PSH, ACK] Seq=175314 Ack=1 Win=64512 Len=2896 TSval=1939598912 TSecr=3899495599"
"119","0.853132","172.28.0.20","172.28.0.10","TCP","2962","55206  >  5000 [PSH, ACK] Seq=178210 Ack=1 Win=64512 Len=2896 TSval=1939598912 TSecr=3899495599"
"120","0.853139","172.28.0.20","172.28.0.10","TCP","1514","[TCP Out-Of-Order] 55206  >  5000 [ACK] Seq=163730 Ack=1 Win=64512 Len=1448 TSval=1939598912 TSecr=3899495599"
"121","0.853160","172.28.0.10","172.28.0.20","TCP","78","5000  >  55206 [ACK] Seq=1 Ack=165178 Win=95232 Len=0 TSval=3899495649 TSecr=1939598912 SLE=166626 SRE=181106"
"122","0.853163","172.28.0.20","172.28.0.10","RSL","1514","unknown 12 "
"123","0.853168","172.28.0.10","172.28.0.20","TCP","78","[TCP Dup ACK 121#1] 5000  >  55206 [ACK] Seq=1 Ack=165178 Win=95232 Len=0 TSval=3899495649 TSecr=1939598912 SLE=166626 SRE=182554"
"124","0.903246","172.28.0.20","172.28.0.10","RSL","2962","[TCP Previous segment not captured] [Malformed Packet]"
"125","0.903279","172.28.0.10","172.28.0.20","TCP","86","[TCP Dup ACK 121#2] 5000  >  55206 [ACK] Seq=1 Ack=165178 Win=95232 Len=0 TSval=3899495699 TSecr=1939598912 SLE=185450 SRE=188346 SLE=166626 SRE=182554"
"126","0.903283","172.28.0.20","172.28.0.10","TCP","1514","55206  >  5000 [ACK] Seq=188346 Ack=1 Win=64512 Len=1448 TSval=1939598962 TSecr=3899495649"
"127","0.903287","172.28.0.20","172.28.0.10","TCP","1514","[TCP Fast Retransmission] 55206  >  5000 [ACK] Seq=165178 Ack=1 Win=64512 Len=1448 TSval=1939598962 TSecr=3899495649"
"128","0.903311","172.28.0.10","172.28.0.20","TCP","78","5000  >  55206 [ACK] Seq=1 Ack=182554 Win=79872 Len=0 TSval=3899495699 TSecr=1939598962 SLE=185450 SRE=189794"
"129","0.953365","172.28.0.20","172.28.0.10","TCP","2962","[TCP Out-Of-Order] 55206  >  5000 [PSH, ACK] Seq=182554 Ack=1 Win=64512 Len=2896 TSval=1939599013 TSecr=3899495699"
"130","0.953404","172.28.0.10","172.28.0.20","TCP","66","5000  >  55206 [ACK] Seq=1 Ack=189794 Win=92160 Len=0 TSval=3899495750 TSecr=1939599013"
"131","0.953407","172.28.0.20","172.28.0.10","TCP","1514","[TCP Previous segment not captured] 55206  >  5000 [ACK] Seq=191242 Ack=1 Win=64512 Len=1448 TSval=1939599013 TSecr=3899495699"
"132","0.953412","172.28.0.10","172.28.0.20","TCP","78","[TCP Dup ACK 130#1] 5000  >  55206 [ACK] Seq=1 Ack=189794 Win=92160 Len=0 TSval=3899495750 TSecr=1939599013 SLE=191242 SRE=192690"
"133","1.003463","172.28.0.20","172.28.0.10","TCP","2962","55206  >  5000 [PSH, ACK] Seq=192690 Ack=1 Win=64512 Len=2896 TSval=1939599063 TSecr=3899495750"
"134","1.003491","172.28.0.10","172.28.0.20","TCP","78","[TCP Window Update] 5000  >  55206 [ACK] Seq=1 Ack=189794 Win=94208 Len=0 TSval=3899495800 TSecr=1939599013 SLE=191242 SRE=195586"
"135","1.003524","172.28.0.20","172.28.0.10","TCP","1514","55206  >  5000 [ACK] Seq=195586 Ack=1 Win=64512 Len=1448 TSval=1939599063 TSecr=3899495750"
"136","1.003530","172.28.0.10","172.28.0.20","TCP","78","[TCP Dup ACK 130#2] 5000  >  55206 [ACK] Seq=1 Ack=189794 Win=94208 Len=0 TSval=3899495800 TSecr=1939599013 SLE=191242 SRE=197034"
"137","1.053726","172.28.0.20","172.28.0.10","TCP","1514","[TCP Out-Of-Order] 55206  >  5000 [ACK] Seq=189794 Ack=1 Win=64512 Len=1448 TSval=1939599113 TSecr=3899495800"
"138","1.053765","172.28.0.10","172.28.0.20","TCP","66","5000  >  55206 [ACK] Seq=1 Ack=197034 Win=92160 Len=0 TSval=3899495850 TSecr=1939599113"
"139","1.053768","172.28.0.20","172.28.0.10","TCP","1514","55206  >  5000 [ACK] Seq=197034 Ack=1 Win=64512 Len=1448 TSval=1939599113 TSecr=3899495800"
"140","1.053773","172.28.0.20","172.28.0.10","TCP","1514","55206  >  5000 [ACK] Seq=198482 Ack=1 Win=64512 Len=1448 TSval=1939599113 TSecr=3899495800"
"141","1.053871","172.28.0.10","172.28.0.20","TCP","66","5000  >  55206 [ACK] Seq=1 Ack=199930 Win=98304 Len=0 TSval=3899495850 TSecr=1939599113"
"142","1.103922","172.28.0.20","172.28.0.10","TCP","2962","55206  >  5000 [PSH, ACK] Seq=199930 Ack=1 Win=64512 Len=2896 TSval=1939599163 TSecr=3899495850"
"143","1.103954","172.28.0.20","172.28.0.10","TCP","2962","55206  >  5000 [PSH, ACK] Seq=202826 Ack=1 Win=64512 Len=2896 TSval=1939599163 TSecr=3899495850"
"144","1.104002","172.28.0.10","172.28.0.20","TCP","66","5000  >  55206 [ACK] Seq=1 Ack=205722 Win=98304 Len=0 TSval=3899495900 TSecr=1939599163"
"145","1.154059","172.28.0.20","172.28.0.10","TCP","2962","55206  >  5000 [PSH, ACK] Seq=205722 Ack=1 Win=64512 Len=2896 TSval=1939599213 TSecr=3899495900"
"146","1.154084","172.28.0.20","172.28.0.10","TCP","2962","55206  >  5000 [PSH, ACK] Seq=208618 Ack=1 Win=64512 Len=2896 TSval=1939599213 TSecr=3899495900"
"147","1.154088","172.28.0.20","172.28.0.10","TCP","1514","55206  >  5000 [ACK] Seq=211514 Ack=1 Win=64512 Len=1448 TSval=1939599213 TSecr=3899495900"
"148","1.154138","172.28.0.10","172.28.0.20","TCP","66","5000  >  55206 [ACK] Seq=1 Ack=212962 Win=98304 Len=0 TSval=3899495950 TSecr=1939599213"
"149","1.204219","172.28.0.20","172.28.0.10","TCP","2962","55206  >  5000 [PSH, ACK] Seq=212962 Ack=1 Win=64512 Len=2896 TSval=1939599263 TSecr=3899495950"
"150","1.204249","172.28.0.20","172.28.0.10","TCP","2962","55206  >  5000 [PSH, ACK] Seq=215858 Ack=1 Win=64512 Len=2896 TSval=1939599263 TSecr=3899495950"
"151","1.204252","172.28.0.20","172.28.0.10","RSL","1514","ERROR REPORT "
"152","1.204279","172.28.0.10","172.28.0.20","TCP","66","5000  >  55206 [ACK] Seq=1 Ack=220202 Win=98304 Len=0 TSval=3899496000 TSecr=1939599263"
"153","1.254344","172.28.0.20","172.28.0.10","TCP","2962","55206  >  5000 [PSH, ACK] Seq=220202 Ack=1 Win=64512 Len=2896 TSval=1939599314 TSecr=3899496000"
"154","1.254383","172.28.0.20","172.28.0.10","RSL","2962","DELETE INDication (CCCH) (SM) "
"155","1.254387","172.28.0.20","172.28.0.10","TCP","1514","55206  >  5000 [ACK] Seq=225994 Ack=1 Win=64512 Len=1448 TSval=1939599314 TSecr=3899496000"
"156","1.254422","172.28.0.10","172.28.0.20","TCP","66","5000  >  55206 [ACK] Seq=1 Ack=227442 Win=98304 Len=0 TSval=3899496051 TSecr=1939599314"
"157","1.304487","172.28.0.20","172.28.0.10","RSL","2962","PAGING Huawei extension "
"158","1.304525","172.28.0.20","172.28.0.10","TCP","2962","55206  >  5000 [PSH, ACK] Seq=230338 Ack=1 Win=64512 Len=2896 TSval=1939599364 TSecr=3899496051"
"159","1.304532","172.28.0.20","172.28.0.10","TCP","2962","55206  >  5000 [PSH, ACK] Seq=233234 Ack=1 Win=64512 Len=2896 TSval=1939599364 TSecr=3899496051"
"160","1.304536","172.28.0.20","172.28.0.10","TCP","1514","55206  >  5000 [ACK] Seq=236130 Ack=1 Win=64512 Len=1448 TSval=1939599364 TSecr=3899496051"
"161","1.304570","172.28.0.10","172.28.0.20","TCP","66","5000  >  55206 [ACK] Seq=1 Ack=237578 Win=98304 Len=0 TSval=3899496101 TSecr=1939599364"
"162","1.354632","172.28.0.20","172.28.0.10","TCP","2962","55206  >  5000 [PSH, ACK] Seq=237578 Ack=1 Win=64512 Len=2896 TSval=1939599414 TSecr=3899496101"
"163","1.354667","172.28.0.20","172.28.0.10","TCP","2962","55206  >  5000 [PSH, ACK] Seq=240474 Ack=1 Win=64512 Len=2896 TSval=1939599414 TSecr=3899496101"
"164","1.354670","172.28.0.20","172.28.0.10","TCP","2962","55206  >  5000 [PSH, ACK] Seq=243370 Ack=1 Win=64512 Len=2896 TSval=1939599414 TSecr=3899496101"
"165","1.354686","172.28.0.20","172.28.0.10","TCP","1514","55206  >  5000 [ACK] Seq=246266 Ack=1 Win=64512 Len=1448 TSval=1939599414 TSecr=3899496101"
"166","1.354713","172.28.0.10","172.28.0.20","TCP","66","5000  >  55206 [ACK] Seq=1 Ack=247714 Win=98304 Len=0 TSval=3899496151 TSecr=1939599414"
"167","1.404783","172.28.0.20","172.28.0.10","TCP","2962","55206  >  5000 [PSH, ACK] Seq=247714 Ack=1 Win=64512 Len=2896 TSval=1939599464 TSecr=3899496151"
"168","1.404818","172.28.0.20","172.28.0.10","TCP","2962","55206  >  5000 [PSH, ACK] Seq=250610 Ack=1 Win=64512 Len=2896 TSval=1939599464 TSecr=3899496151"
"169","1.404821","172.28.0.20","172.28.0.10","TCP","2962","55206  >  5000 [PSH, ACK] Seq=253506 Ack=1 Win=64512 Len=2896 TSval=1939599464 TSecr=3899496151"
"170","1.404824","172.28.0.20","172.28.0.10","TCP","1514","55206  >  5000 [ACK] Seq=256402 Ack=1 Win=64512 Len=1448 TSval=1939599464 TSecr=3899496151"
"171","1.404858","172.28.0.10","172.28.0.20","TCP","66","5000  >  55206 [ACK] Seq=1 Ack=257850 Win=98304 Len=0 TSval=3899496201 TSecr=1939599464"
"172","1.454931","172.28.0.20","172.28.0.10","TCP","2962","55206  >  5000 [PSH, ACK] Seq=257850 Ack=1 Win=64512 Len=2896 TSval=1939599514 TSecr=3899496201"
"173","1.454970","172.28.0.20","172.28.0.10","TCP","2962","55206  >  5000 [PSH, ACK] Seq=260746 Ack=1 Win=64512 Len=2896 TSval=1939599514 TSecr=3899496201"
"174","1.454974","172.28.0.20","172.28.0.10","TCP","2962","55206  >  5000 [PSH, ACK] Seq=263642 Ack=1 Win=64512 Len=2896 TSval=1939599514 TSecr=3899496201"
"175","1.454976","172.28.0.20","172.28.0.10","TCP","1514","55206  >  5000 [ACK] Seq=266538 Ack=1 Win=64512 Len=1448 TSval=1939599514 TSecr=3899496201"
"176","1.455099","172.28.0.10","172.28.0.20","TCP","66","5000  >  55206 [ACK] Seq=1 Ack=267986 Win=98304 Len=0 TSval=3899496251 TSecr=1939599514"
"177","1.505168","172.28.0.20","172.28.0.10","TCP","2962","55206  >  5000 [PSH, ACK] Seq=267986 Ack=1 Win=64512 Len=2896 TSval=1939599564 TSecr=3899496251"
"178","1.505195","172.28.0.20","172.28.0.10","RSL","2962","[TCP Previous segment not captured] PAGING Huawei extension "
"179","1.505212","172.28.0.10","172.28.0.20","TCP","78","5000  >  55206 [ACK] Seq=1 Ack=270882 Win=96256 Len=0 TSval=3899496301 TSecr=1939599564 SLE=273778 SRE=276674"
"180","1.505215","172.28.0.20","172.28.0.10","TCP","2962","55206  >  5000 [PSH, ACK] Seq=276674 Ack=1 Win=64512 Len=2896 TSval=1939599564 TSecr=3899496251"
"181","1.505220","172.28.0.10","172.28.0.20","TCP","78","[TCP Dup ACK 179#1] 5000  >  55206 [ACK] Seq=1 Ack=270882 Win=96256 Len=0 TSval=3899496301 TSecr=1939599564 SLE=273778 SRE=279570"
"182","1.505221","172.28.0.20","172.28.0.10","TCP","1514","55206  >  5000 [ACK] Seq=279570 Ack=1 Win=64512 Len=1448 TSval=1939599564 TSecr=3899496251"
"183","1.505225","172.28.0.10","172.28.0.20","TCP","78","[TCP Dup ACK 179#2] 5000  >  55206 [ACK] Seq=1 Ack=270882 Win=96256 Len=0 TSval=3899496301 TSecr=1939599564 SLE=273778 SRE=281018"
"184","1.555303","172.28.0.20","172.28.0.10","TCP","2962","55206  >  5000 [PSH, ACK] Seq=281018 Ack=1 Win=64512 Len=2896 TSval=1939599614 TSecr=3899496301"
"185","1.555330","172.28.0.20","172.28.0.10","TCP","2962","55206  >  5000 [PSH, ACK] Seq=283914 Ack=1 Win=64512 Len=2896 TSval=1939599614 TSecr=3899496301"
"186","1.555332","172.28.0.20","172.28.0.10","TCP","1514","[TCP Out-Of-Order] 55206  >  5000 [ACK] Seq=270882 Ack=1 Win=64512 Len=1448 TSval=1939599614 TSecr=3899496301"
"187","1.555343","172.28.0.10","172.28.0.20","TCP","78","5000  >  55206 [ACK] Seq=1 Ack=272330 Win=95232 Len=0 TSval=3899496352 TSecr=1939599614 SLE=273778 SRE=286810"
"188","1.555345","172.28.0.20","172.28.0.10","TCP","1514","[TCP Out-Of-Order] 55206  >  5000 [ACK] Seq=272330 Ack=1 Win=64512 Len=1448 TSval=1939599614 TSecr=3899496301"
"189","1.555350","172.28.0.10","172.28.0.20","TCP","66","5000  >  55206 [ACK] Seq=1 Ack=286810 Win=84992 Len=0 TSval=3899496352 TSecr=1939599614"
"190","1.605417","172.28.0.20","172.28.0.10","TCP","2962","55206  >  5000 [PSH, ACK] Seq=286810 Ack=1 Win=64512 Len=2896 TSval=1939599665 TSecr=3899496352"
"191","1.605467","172.28.0.10","172.28.0.20","TCP","66","5000  >  55206 [ACK] Seq=1 Ack=289706 Win=96256 Len=0 TSval=3899496402 TSecr=1939599665"
"192","1.605471","172.28.0.20","172.28.0.10","TCP","2962","55206  >  5000 [PSH, ACK] Seq=289706 Ack=1 Win=64512 Len=2896 TSval=1939599665 TSecr=3899496352"
"193","1.605479","172.28.0.20","172.28.0.10","TCP","1514","[TCP Previous segment not captured] 55206  >  5000 [ACK] Seq=294050 Ack=1 Win=64512 Len=1448 TSval=1939599665 TSecr=3899496352"
"194","1.605488","172.28.0.10","172.28.0.20","TCP","78","5000  >  55206 [ACK] Seq=1 Ack=292602 Win=94208 Len=0 TSval=3899496402 TSecr=1939599665 SLE=294050 SRE=295498"
"195","1.655691","172.28.0.20","172.28.0.10","TCP","2962","55206  >  5000 [PSH, ACK] Seq=295498 Ack=1 Win=64512 Len=2896 TSval=1939599715 TSecr=3899496402"
"196","1.655713","172.28.0.10","172.28.0.20","TCP","78","[TCP Dup ACK 194#1] 5000  >  55206 [ACK] Seq=1 Ack=292602 Win=94208 Len=0 TSval=3899496452 TSecr=1939599665 SLE=294050 SRE=298394"
"197","1.655716","172.28.0.20","172.28.0.10","TCP","2962","55206  >  5000 [PSH, ACK] Seq=298394 Ack=1 Win=64512 Len=2896 TSval=1939599715 TSecr=3899496402"
"198","1.655718","172.28.0.10","172.28.0.20","TCP","78","[TCP Dup ACK 194#2] 5000  >  55206 [ACK] Seq=1 Ack=292602 Win=94208 Len=0 TSval=3899496452 TSecr=1939599665 SLE=294050 SRE=301290"
"199","1.655718","172.28.0.20","172.28.0.10","TCP","2962","55206  >  5000 [PSH, ACK] Seq=301290 Ack=1 Win=64512 Len=2896 TSval=1939599715 TSecr=3899496402"
"200","1.656857","172.28.0.10","172.28.0.20","TCP","78","[TCP Dup ACK 194#3] 5000  >  55206 [ACK] Seq=1 Ack=292602 Win=94208 Len=0 TSval=3899496453 TSecr=1939599665 SLE=294050 SRE=304186"
"201","1.671473","172.28.0.20","172.28.0.10","TCP","1514","[TCP Fast Retransmission] 55206  >  5000 [ACK] Seq=292602 Ack=1 Win=64512 Len=1448 TSval=1939599731 TSecr=3899496402"
"202","1.671521","172.28.0.10","172.28.0.20","TCP","66","5000  >  55206 [ACK] Seq=1 Ack=304186 Win=89088 Len=0 TSval=3899496468 TSecr=1939599731"
"203","1.705773","172.28.0.20","172.28.0.10","TCP","1514","55206  >  5000 [ACK] Seq=304186 Ack=1 Win=64512 Len=1448 TSval=1939599765 TSecr=3899496452"
"204","1.706903","172.28.0.20","172.28.0.10","TCP","2962","55206  >  5000 [PSH, ACK] Seq=305634 Ack=1 Win=64512 Len=2896 TSval=1939599766 TSecr=3899496453"
"205","1.706920","172.28.0.10","172.28.0.20","TCP","66","5000  >  55206 [ACK] Seq=1 Ack=308530 Win=96256 Len=0 TSval=3899496503 TSecr=1939599765"
"206","1.721648","172.28.0.20","172.28.0.10","TCP","1514","55206  >  5000 [PSH, ACK] Seq=308530 Ack=1 Win=64512 Len=1448 TSval=1939599781 TSecr=3899496468"
"207","1.721686","172.28.0.10","172.28.0.20","TCP","66","5000  >  55206 [ACK] Seq=1 Ack=309978 Win=98304 Len=0 TSval=3899496518 TSecr=1939599781"
"208","1.757056","172.28.0.20","172.28.0.10","TCP","2962","55206  >  5000 [PSH, ACK] Seq=309978 Ack=1 Win=64512 Len=2896 TSval=1939599816 TSecr=3899496503"
"209","1.757095","172.28.0.20","172.28.0.10","TCP","2962","55206  >  5000 [PSH, ACK] Seq=312874 Ack=1 Win=64512 Len=2896 TSval=1939599816 TSecr=3899496503"
"210","1.757134","172.28.0.10","172.28.0.20","TCP","66","5000  >  55206 [ACK] Seq=1 Ack=315770 Win=98304 Len=0 TSval=3899496553 TSecr=1939599816"
"211","1.771829","172.28.0.20","172.28.0.10","RSL","1514","DELETE INDication (CCCH) (SM) "
"212","1.807206","172.28.0.20","172.28.0.10","TCP","2962","55206  >  5000 [PSH, ACK] Seq=317218 Ack=1 Win=64512 Len=2896 TSval=1939599866 TSecr=3899496553"
"213","1.807249","172.28.0.10","172.28.0.20","TCP","66","5000  >  55206 [ACK] Seq=1 Ack=320114 Win=96256 Len=0 TSval=3899496603 TSecr=1939599831"
"214","1.807254","172.28.0.20","172.28.0.10","RSL","2962","PAGING Huawei extension "
"215","1.807313","172.28.0.10","172.28.0.20","TCP","66","5000  >  55206 [ACK] Seq=1 Ack=323010 Win=98304 Len=0 TSval=3899496604 TSecr=1939599866"
"216","1.857416","172.28.0.20","172.28.0.10","TCP","2962","55206  >  5000 [PSH, ACK] Seq=323010 Ack=1 Win=64512 Len=2896 TSval=1939599916 TSecr=3899496603"
"217","1.857454","172.28.0.20","172.28.0.10","TCP","1514","55206  >  5000 [ACK] Seq=325906 Ack=1 Win=64512 Len=1448 TSval=1939599916 TSecr=3899496603"
"218","1.857459","172.28.0.20","172.28.0.10","TCP","2962","55206  >  5000 [PSH, ACK] Seq=327354 Ack=1 Win=64512 Len=2896 TSval=1939599917 TSecr=3899496604"
"219","1.857497","172.28.0.10","172.28.0.20","TCP","66","5000  >  55206 [ACK] Seq=1 Ack=330250 Win=98304 Len=0 TSval=3899496654 TSecr=1939599916"
"220","1.907554","172.28.0.20","172.28.0.10","TCP","2962","55206  >  5000 [PSH, ACK] Seq=330250 Ack=1 Win=64512 Len=2896 TSval=1939599967 TSecr=3899496654"
"221","1.907586","172.28.0.20","172.28.0.10","TCP","2962","55206  >  5000 [PSH, ACK] Seq=333146 Ack=1 Win=64512 Len=2896 TSval=1939599967 TSecr=3899496654"
"222","1.907590","172.28.0.20","172.28.0.10","TCP","2962","55206  >  5000 [PSH, ACK] Seq=336042 Ack=1 Win=64512 Len=2896 TSval=1939599967 TSecr=3899496654"
"223","1.907593","172.28.0.20","172.28.0.10","TCP","1514","55206  >  5000 [ACK] Seq=338938 Ack=1 Win=64512 Len=1448 TSval=1939599967 TSecr=3899496654"
"224","1.907624","172.28.0.10","172.28.0.20","TCP","66","5000  >  55206 [ACK] Seq=1 Ack=340386 Win=98304 Len=0 TSval=3899496704 TSecr=1939599967"
"225","1.957681","172.28.0.20","172.28.0.10","TCP","2962","55206  >  5000 [PSH, ACK] Seq=340386 Ack=1 Win=64512 Len=2896 TSval=1939600017 TSecr=3899496704"
"226","1.957711","172.28.0.20","172.28.0.10","TCP","2962","55206  >  5000 [PSH, ACK] Seq=343282 Ack=1 Win=64512 Len=2896 TSval=1939600017 TSecr=3899496704"
"227","1.957715","172.28.0.20","172.28.0.10","TCP","2962","55206  >  5000 [PSH, ACK] Seq=346178 Ack=1 Win=64512 Len=2896 TSval=1939600017 TSecr=3899496704"
"228","1.957717","172.28.0.20","172.28.0.10","TCP","1514","55206  >  5000 [ACK] Seq=349074 Ack=1 Win=64512 Len=1448 TSval=1939600017 TSecr=3899496704"
"229","1.957743","172.28.0.10","172.28.0.20","TCP","66","5000  >  55206 [ACK] Seq=1 Ack=350522 Win=98304 Len=0 TSval=3899496754 TSecr=1939600017"
"230","2.007805","172.28.0.20","172.28.0.10","TCP","2962","55206  >  5000 [PSH, ACK] Seq=350522 Ack=1 Win=64512 Len=2896 TSval=1939600067 TSecr=3899496754"
"231","2.007839","172.28.0.20","172.28.0.10","TCP","2962","55206  >  5000 [PSH, ACK] Seq=353418 Ack=1 Win=64512 Len=2896 TSval=1939600067 TSecr=3899496754"
"232","2.007843","172.28.0.20","172.28.0.10","TCP","2962","55206  >  5000 [PSH, ACK] Seq=356314 Ack=1 Win=64512 Len=2896 TSval=1939600067 TSecr=3899496754"
"233","2.007846","172.28.0.20","172.28.0.10","TCP","1514","55206  >  5000 [ACK] Seq=359210 Ack=1 Win=64512 Len=1448 TSval=1939600067 TSecr=3899496754"
"234","2.007877","172.28.0.10","172.28.0.20","TCP","66","5000  >  55206 [ACK] Seq=1 Ack=360658 Win=98304 Len=0 TSval=3899496804 TSecr=1939600067"
"235","2.058047","172.28.0.20","172.28.0.10","TCP","2962","55206  >  5000 [PSH, ACK] Seq=360658 Ack=1 Win=64512 Len=2896 TSval=1939600117 TSecr=3899496804"
"236","2.058083","172.28.0.20","172.28.0.10","TCP","2962","55206  >  5000 [PSH, ACK] Seq=363554 Ack=1 Win=64512 Len=2896 TSval=1939600117 TSecr=3899496804"
"237","2.058086","172.28.0.20","172.28.0.10","RSL","2962","PAGING Huawei extension "
"238","2.058089","172.28.0.20","172.28.0.10","TCP","1514","55206  >  5000 [ACK] Seq=369346 Ack=1 Win=64512 Len=1448 TSval=1939600117 TSecr=3899496804"
"239","2.058126","172.28.0.10","172.28.0.20","TCP","66","5000  >  55206 [ACK] Seq=1 Ack=370794 Win=98304 Len=0 TSval=3899496854 TSecr=1939600117"
"240","2.108195","172.28.0.20","172.28.0.10","RSL","2962","[Malformed Packet]"
"241","2.108227","172.28.0.20","172.28.0.10","TCP","2962","55206  >  5000 [PSH, ACK] Seq=373690 Ack=1 Win=64512 Len=2896 TSval=1939600167 TSecr=3899496854"
"242","2.108231","172.28.0.20","172.28.0.10","TCP","2962","55206  >  5000 [PSH, ACK] Seq=376586 Ack=1 Win=64512 Len=2896 TSval=1939600167 TSecr=3899496854"
"243","2.108233","172.28.0.20","172.28.0.10","TCP","2962","55206  >  5000 [PSH, ACK] Seq=379482 Ack=1 Win=64512 Len=2896 TSval=1939600167 TSecr=3899496854"
"244","2.108236","172.28.0.20","172.28.0.10","TCP","1514","55206  >  5000 [ACK] Seq=382378 Ack=1 Win=64512 Len=1448 TSval=1939600167 TSecr=3899496854"
"245","2.108331","172.28.0.10","172.28.0.20","TCP","66","5000  >  55206 [ACK] Seq=1 Ack=383826 Win=98304 Len=0 TSval=3899496905 TSecr=1939600167"
"246","2.158406","172.28.0.20","172.28.0.10","TCP","2962","55206  >  5000 [PSH, ACK] Seq=383826 Ack=1 Win=64512 Len=2896 TSval=1939600218 TSecr=3899496905"
"247","2.158443","172.28.0.20","172.28.0.10","TCP","2962","55206  >  5000 [PSH, ACK] Seq=386722 Ack=1 Win=64512 Len=2896 TSval=1939600218 TSecr=3899496905"
"248","2.158447","172.28.0.20","172.28.0.10","TCP","2962","55206  >  5000 [PSH, ACK] Seq=389618 Ack=1 Win=64512 Len=2896 TSval=1939600218 TSecr=3899496905"
"249","2.158450","172.28.0.20","172.28.0.10","TCP","2962","55206  >  5000 [PSH, ACK] Seq=392514 Ack=1 Win=64512 Len=2896 TSval=1939600218 TSecr=3899496905"
"250","2.158452","172.28.0.20","172.28.0.10","TCP","1514","55206  >  5000 [ACK] Seq=395410 Ack=1 Win=64512 Len=1448 TSval=1939600218 TSecr=3899496905"
"251","2.158485","172.28.0.10","172.28.0.20","TCP","66","5000  >  55206 [ACK] Seq=1 Ack=396858 Win=98304 Len=0 TSval=3899496955 TSecr=1939600218"
"252","2.208544","172.28.0.20","172.28.0.10","TCP","2962","55206  >  5000 [PSH, ACK] Seq=396858 Ack=1 Win=64512 Len=2896 TSval=1939600268 TSecr=3899496955"
"253","2.208577","172.28.0.20","172.28.0.10","TCP","2962","55206  >  5000 [PSH, ACK] Seq=399754 Ack=1 Win=64512 Len=2896 TSval=1939600268 TSecr=3899496955"
"254","2.208581","172.28.0.20","172.28.0.10","TCP","2962","55206  >  5000 [PSH, ACK] Seq=402650 Ack=1 Win=64512 Len=2896 TSval=1939600268 TSecr=3899496955"
"255","2.208584","172.28.0.20","172.28.0.10","TCP","2962","55206  >  5000 [PSH, ACK] Seq=405546 Ack=1 Win=64512 Len=2896 TSval=1939600268 TSecr=3899496955"
"256","2.208586","172.28.0.20","172.28.0.10","RSL","1514","DELETE INDication (CCCH) (SM) "
"257","2.208625","172.28.0.10","172.28.0.20","TCP","66","5000  >  55206 [ACK] Seq=1 Ack=409890 Win=98304 Len=0 TSval=3899497005 TSecr=1939600268"
"258","2.258787","172.28.0.20","172.28.0.10","TCP","2962","55206  >  5000 [PSH, ACK] Seq=409890 Ack=1 Win=64512 Len=2896 TSval=1939600318 TSecr=3899497005"
"259","2.258816","172.28.0.20","172.28.0.10","RSL","2962","PAGING Huawei extension "
"260","2.258819","172.28.0.20","172.28.0.10","TCP","2962","55206  >  5000 [PSH, ACK] Seq=415682 Ack=1 Win=64512 Len=2896 TSval=1939600318 TSecr=3899497005"
"261","2.258822","172.28.0.20","172.28.0.10","TCP","2962","55206  >  5000 [PSH, ACK] Seq=418578 Ack=1 Win=64512 Len=2896 TSval=1939600318 TSecr=3899497005"
"262","2.258824","172.28.0.20","172.28.0.10","TCP","1514","55206  >  5000 [ACK] Seq=421474 Ack=1 Win=64512 Len=1448 TSval=1939600318 TSecr=3899497005"
"263","2.258855","172.28.0.10","172.28.0.20","TCP","66","5000  >  55206 [ACK] Seq=1 Ack=422922 Win=98304 Len=0 TSval=3899497055 TSecr=1939600318"
"264","2.308922","172.28.0.20","172.28.0.10","TCP","2962","55206  >  5000 [PSH, ACK] Seq=422922 Ack=1 Win=64512 Len=2896 TSval=1939600368 TSecr=3899497055"
"265","2.308943","172.28.0.20","172.28.0.10","TCP","2962","55206  >  5000 [PSH, ACK] Seq=425818 Ack=1 Win=64512 Len=2896 TSval=1939600368 TSecr=3899497055"
"266","2.308944","172.28.0.20","172.28.0.10","TCP","2962","[TCP Previous segment not captured] 55206  >  5000 [PSH, ACK] Seq=431610 Ack=1 Win=64512 Len=2896 TSval=1939600368 TSecr=3899497055"
"267","2.308952","172.28.0.10","172.28.0.20","TCP","78","5000  >  55206 [ACK] Seq=1 Ack=428714 Win=93184 Len=0 TSval=3899497105 TSecr=1939600368 SLE=431610 SRE=434506"
"268","2.308955","172.28.0.20","172.28.0.10","TCP","2962","55206  >  5000 [PSH, ACK] Seq=434506 Ack=1 Win=64512 Len=2896 TSval=1939600368 TSecr=3899497055"
"269","2.308957","172.28.0.10","172.28.0.20","TCP","78","[TCP Dup ACK 267#1] 5000  >  55206 [ACK] Seq=1 Ack=428714 Win=93184 Len=0 TSval=3899497105 TSecr=1939600368 SLE=431610 SRE=437402"
"270","2.308958","172.28.0.20","172.28.0.10","TCP","1514","55206  >  5000 [ACK] Seq=437402 Ack=1 Win=64512 Len=1448 TSval=1939600368 TSecr=3899497055"
"271","2.308960","172.28.0.10","172.28.0.20","TCP","78","[TCP Dup ACK 267#2] 5000  >  55206 [ACK] Seq=1 Ack=428714 Win=93184 Len=0 TSval=3899497105 TSecr=1939600368 SLE=431610 SRE=438850"
"272","2.359027","172.28.0.20","172.28.0.10","TCP","2962","55206  >  5000 [PSH, ACK] Seq=438850 Ack=1 Win=64512 Len=2896 TSval=1939600418 TSecr=3899497105"
"273","2.359049","172.28.0.20","172.28.0.10","TCP","2962","55206  >  5000 [PSH, ACK] Seq=441746 Ack=1 Win=64512 Len=2896 TSval=1939600418 TSecr=3899497105"
"274","2.359051","172.28.0.20","172.28.0.10","TCP","2962","55206  >  5000 [PSH, ACK] Seq=444642 Ack=1 Win=64512 Len=2896 TSval=1939600418 TSecr=3899497105"
"275","2.359053","172.28.0.20","172.28.0.10","TCP","1514","[TCP Out-Of-Order] 55206  >  5000 [ACK] Seq=428714 Ack=1 Win=64512 Len=1448 TSval=1939600418 TSecr=3899497105"
"276","2.359072","172.28.0.10","172.28.0.20","TCP","78","5000  >  55206 [ACK] Seq=1 Ack=430162 Win=92160 Len=0 TSval=3899497155 TSecr=1939600418 SLE=431610 SRE=447538"
"277","2.409141","172.28.0.20","172.28.0.10","TCP","1514","[TCP Out-Of-Order] 55206  >  5000 [ACK] Seq=430162 Ack=1 Win=64512 Len=1448 TSval=1939600468 TSecr=3899497155"
"278","2.409182","172.28.0.10","172.28.0.20","TCP","66","5000  >  55206 [ACK] Seq=1 Ack=447538 Win=83968 Len=0 TSval=3899497205 TSecr=1939600468"
"279","2.409186","172.28.0.20","172.28.0.10","TCP","2962","55206  >  5000 [PSH, ACK] Seq=447538 Ack=1 Win=64512 Len=2896 TSval=1939600468 TSecr=3899497155"
"280","2.409191","172.28.0.20","172.28.0.10","RSL","2962","ERROR REPORT "
"281","2.409236","172.28.0.10","172.28.0.20","TCP","66","5000  >  55206 [ACK] Seq=1 Ack=453330 Win=98304 Len=0 TSval=3899497205 TSecr=1939600468"
"282","2.459266","172.28.0.20","172.28.0.10","TCP","1514","[TCP Previous segment not captured] 55206  >  5000 [ACK] Seq=456226 Ack=1 Win=64512 Len=1448 TSval=1939600518 TSecr=3899497205"
"283","2.459305","172.28.0.10","172.28.0.20","TCP","78","[TCP Dup ACK 281#1] 5000  >  55206 [ACK] Seq=1 Ack=453330 Win=98304 Len=0 TSval=3899497255 TSecr=1939600468 SLE=456226 SRE=457674"
"284","2.459309","172.28.0.20","172.28.0.10","TCP","2962","55206  >  5000 [PSH, ACK] Seq=457674 Ack=1 Win=64512 Len=2896 TSval=1939600518 TSecr=3899497205"
"285","2.459314","172.28.0.10","172.28.0.20","TCP","78","[TCP Dup ACK 281#2] 5000  >  55206 [ACK] Seq=1 Ack=453330 Win=98304 Len=0 TSval=3899497256 TSecr=1939600468 SLE=456226 SRE=460570"
"286","2.459316","172.28.0.20","172.28.0.10","TCP","2962","55206  >  5000 [PSH, ACK] Seq=460570 Ack=1 Win=64512 Len=2896 TSval=1939600518 TSecr=3899497205"
"287","2.459320","172.28.0.10","172.28.0.20","TCP","78","[TCP Dup ACK 281#3] 5000  >  55206 [ACK] Seq=1 Ack=453330 Win=98304 Len=0 TSval=3899497256 TSecr=1939600468 SLE=456226 SRE=463466"
"288","2.509443","172.28.0.20","172.28.0.10","TCP","1514","[TCP Out-Of-Order] 55206  >  5000 [ACK] Seq=453330 Ack=1 Win=64512 Len=1448 TSval=1939600569 TSecr=3899497255"
"289","2.509485","172.28.0.10","172.28.0.20","TCP","78","5000  >  55206 [ACK] Seq=1 Ack=454778 Win=97280 Len=0 TSval=3899497306 TSecr=1939600569 SLE=456226 SRE=463466"
"290","2.509488","172.28.0.20","172.28.0.10","TCP","1514","[TCP Out-Of-Order] 55206  >  5000 [ACK] Seq=454778 Ack=1 Win=64512 Len=1448 TSval=1939600569 TSecr=3899497256"
"291","2.509497","172.28.0.10","172.28.0.20","TCP","66","5000  >  55206 [ACK] Seq=1 Ack=463466 Win=89088 Len=0 TSval=3899497306 TSecr=1939600569"
"292","2.509499","172.28.0.20","172.28.0.10","RSL","2962","[Malformed Packet]"
"293","2.509556","172.28.0.10","172.28.0.20","TCP","66","5000  >  55206 [ACK] Seq=1 Ack=466362 Win=98304 Len=0 TSval=3899497306 TSecr=1939600569"
"294","2.559552","172.28.0.20","172.28.0.10","TCP","1514","55206  >  5000 [ACK] Seq=466362 Ack=1 Win=64512 Len=1448 TSval=1939600619 TSecr=3899497306"
"295","2.559606","172.28.0.20","172.28.0.10","TCP","2962","55206  >  5000 [PSH, ACK] Seq=467810 Ack=1 Win=64512 Len=2896 TSval=1939600619 TSecr=3899497306"
"296","2.559611","172.28.0.20","172.28.0.10","TCP","1514","55206  >  5000 [ACK] Seq=470706 Ack=1 Win=64512 Len=1448 TSval=1939600619 TSecr=3899497306"
"297","2.559642","172.28.0.10","172.28.0.20","TCP","66","5000  >  55206 [ACK] Seq=1 Ack=472154 Win=98304 Len=0 TSval=3899497356 TSecr=1939600619"
"298","2.609771","172.28.0.20","172.28.0.10","TCP","2962","55206  >  5000 [PSH, ACK] Seq=472154 Ack=1 Win=64512 Len=2896 TSval=1939600669 TSecr=3899497356"
"299","2.609805","172.28.0.20","172.28.0.10","TCP","2962","55206  >  5000 [PSH, ACK] Seq=475050 Ack=1 Win=64512 Len=2896 TSval=1939600669 TSecr=3899497356"
"300","2.609809","172.28.0.20","172.28.0.10","TCP","1514","55206  >  5000 [ACK] Seq=477946 Ack=1 Win=64512 Len=1448 TSval=1939600669 TSecr=3899497356"
"301","2.609844","172.28.0.10","172.28.0.20","TCP","66","5000  >  55206 [ACK] Seq=1 Ack=479394 Win=98304 Len=0 TSval=3899497406 TSecr=1939600669"
"302","2.659914","172.28.0.20","172.28.0.10","TCP","2962","55206  >  5000 [PSH, ACK] Seq=479394 Ack=1 Win=64512 Len=2896 TSval=1939600719 TSecr=3899497406"
"303","2.659938","172.28.0.20","172.28.0.10","TCP","2962","55206  >  5000 [PSH, ACK] Seq=482290 Ack=1 Win=64512 Len=2896 TSval=1939600719 TSecr=3899497406"
"304","2.659941","172.28.0.20","172.28.0.10","TCP","1514","55206  >  5000 [ACK] Seq=485186 Ack=1 Win=64512 Len=1448 TSval=1939600719 TSecr=3899497406"
"305","2.659965","172.28.0.10","172.28.0.20","TCP","66","5000  >  55206 [ACK] Seq=1 Ack=486634 Win=98304 Len=0 TSval=3899497456 TSecr=1939600719"
"306","2.710121","172.28.0.20","172.28.0.10","TCP","2962","55206  >  5000 [PSH, ACK] Seq=486634 Ack=1 Win=64512 Len=2896 TSval=1939600769 TSecr=3899497456"
"307","2.710161","172.28.0.20","172.28.0.10","TCP","2962","55206  >  5000 [PSH, ACK] Seq=489530 Ack=1 Win=64512 Len=2896 TSval=1939600769 TSecr=3899497456"
"308","2.710165","172.28.0.20","172.28.0.10","TCP","1514","55206  >  5000 [ACK] Seq=492426 Ack=1 Win=64512 Len=1448 TSval=1939600769 TSecr=3899497456"
"309","2.710206","172.28.0.10","172.28.0.20","TCP","66","5000  >  55206 [ACK] Seq=1 Ack=493874 Win=98304 Len=0 TSval=3899497506 TSecr=1939600769"
"310","2.760280","172.28.0.20","172.28.0.10","TCP","2962","55206  >  5000 [PSH, ACK] Seq=493874 Ack=1 Win=64512 Len=2896 TSval=1939600819 TSecr=3899497506"
"311","2.760317","172.28.0.20","172.28.0.10","RSL","2962","ERROR REPORT "
"312","2.760322","172.28.0.20","172.28.0.10","TCP","2962","55206  >  5000 [PSH, ACK] Seq=499666 Ack=1 Win=64512 Len=2896 TSval=1939600819 TSecr=3899497506"
"313","2.760324","172.28.0.20","172.28.0.10","TCP","1514","55206  >  5000 [ACK] Seq=502562 Ack=1 Win=64512 Len=1448 TSval=1939600819 TSecr=3899497506"
"314","2.760351","172.28.0.10","172.28.0.20","TCP","66","5000  >  55206 [ACK] Seq=1 Ack=504010 Win=98304 Len=0 TSval=3899497557 TSecr=1939600819"
"315","2.810520","172.28.0.20","172.28.0.10","TCP","2962","55206  >  5000 [PSH, ACK] Seq=504010 Ack=1 Win=64512 Len=2896 TSval=1939600870 TSecr=3899497557"
"316","2.810560","172.28.0.20","172.28.0.10","TCP","2962","55206  >  5000 [PSH, ACK] Seq=506906 Ack=1 Win=64512 Len=2896 TSval=1939600870 TSecr=3899497557"
"317","2.810563","172.28.0.20","172.28.0.10","RSL","2370","[Malformed Packet]"
"318","2.810603","172.28.0.10","172.28.0.20","TCP","66","5000  >  55206 [ACK] Seq=1 Ack=512106 Win=98304 Len=0 TSval=3899497607 TSecr=1939600870"
"319","2.811019","172.28.0.10","172.28.0.20","TCP","69","5000  >  55206 [PSH, ACK] Seq=1 Ack=512106 Win=98304 Len=3 TSval=3899497607 TSecr=1939600870"
"320","2.861071","172.28.0.20","172.28.0.10","TCP","66","55206  >  5000 [ACK] Seq=512106 Ack=4 Win=64512 Len=0 TSval=1939600920 TSecr=3899497607"
"321","2.861123","172.28.0.20","172.28.0.10","TCP","66","55206  >  5000 [FIN, ACK] Seq=512106 Ack=4 Win=64512 Len=0 TSval=1939600920 TSecr=3899497607"
"322","2.901343","172.28.0.10","172.28.0.20","TCP","66","5000  >  55206 [ACK] Seq=4 Ack=512107 Win=98304 Len=0 TSval=3899497698 TSecr=1939600920"
